courseId,id,subType,optionCount,subDescript,option0,option1,option2,option3,answer
61,55325,单选题,4,毛泽东第一次明确提出“马克思主义的‘本本”’是要学习的，但必须同我国的实际情况相结合的观点的著作是(),《井冈山的斗争》,《反对本本主义》,《湖南农民运动考察报告》,《中国的红色政权为什么能够存在？》,B
61,55310,单选题,4,“国民革命需要一个大的农村变动。辛亥革命没有这个变动，所以失败了。”毛泽东这个观点指出辛亥革命失败的原因在于(),没有提出彻底的反帝的革命纲领,不能充分发动和依靠人民群众,不能建立坚强的革命政党,没有提出彻底的反封建的革命纲领,B
61,40656,单选题,4,1947年在国统区爆发的大规模的爱国学生运动是(),一二·九运动,五·二〇运动,一二·一运动,一二·三运动,B
61,40672,单选题,4,中国共产党第一次完整地概括社会主义初级阶段基本路线的会议是(),中共十三大,中共十四大,中共十五大,中共十六大,A
61,40514,单选题,4,中华苏维埃共和国政权的性质是(),工农民主政权,资产阶级政权,无产阶级政权,地主阶级政权,A
61,55319,单选题,4,1919—1949年，中国新民主主义革命必须实现的首要任务是 ()  ,反对帝国主义  ,反对封建主义  ,反对官僚资本主义  ,反对民族资本主义,A
61,40597,单选题,4,1947年10月10日，《中国人民解放军总部宣言》正式提出的口号是(),打倒蒋介石，解放全中国,向北发展，向南防御,和平.民主.团结,将革命进行到底,A
61,55266,单选题,4,1978年12月13日，邓小平在中央工作会议闭幕会上发表讲话的题目是()。,《完整地准确地理解毛泽东思想》,《实现四化，永不称霸》,《解放思想，实事求是，团结一致向前看》,《尊重知识，尊重人才》,C
61,31972,单选题,4,抗战后期，在三届三次国民参政会上，提出结束国民党一党专政，建立民联合政府主张的中共代表是(),毛泽东,林伯渠,董必武,周恩来,B
61,40443,单选题,4,在孙中山的思想中，“平均地权”、“节制资本”属于(),民族主义,民权主义,民主主义,民生主义,D
61,40560,单选题,4,在1940年至1943年抗日民主根据地出现严重困难时，首先开展大生产运动的是(),陕甘宁边区,晋察冀抗日根据地,晋西北抗日根据地,晋冀豫抗日根据地,A
61,40541,单选题,4,1931年1月至1935年1月的第三次“左”倾教条主义错误的代表是(),瞿秋白,李立三,王明,张国焘,C
61,40362,单选题,4,世界历史开始进入资本主义时代的标志性事件是()。,1640年英国资产阶级革命,1680年俄国彼得一世改革,1789年法国大革命,1868年日本明治维新,A
61,40415,单选题,4,清政府正式加封的首任台湾巡抚是(),丁日昌,刘铭传,丘逢甲,唐景崧,B
61,40402,单选题,4,最能体现太平天国社会理想和这次农民战争特点的纲领性文件是()。,《资政新篇》,《天朝田亩制度》,《原道救世歌》,《原道醒世训》,B
61,55270,单选题,4,党的“十四大”召开的时间是()。,1990,1991,1992,1997,C
61,40608,单选题,4,建国初，对官僚资本采取的方针是(),赎买,保持原状,没收,拍卖,C
61,31801,单选题,4,1905年至1907年，资产阶级革命派与改良派论战的焦点是(),要不要打倒列强,要不要实行共和,要不要以革命手段推翻清政府,要不要废科举，兴学堂,C
61,40491,单选题,4,中共二大指出革命的动力是(),学生,农民,大地主,大官僚,B
61,31816,单选题,4,2005年，我国通过《反分裂国家法》的会议是(),十届全国人大二次会议,十届全国人大三次会议,十届全国人大四次会议,十届全国人大五次会议,B
61,31829,单选题,4,20世纪70年代，毛泽东、周恩来抓住时机发起了改善中美关系的(),“篮球外交”,“乒乓外交”,“网球外交”,“围棋外交”,B
61,40510,单选题,4,中国共产党在土地革命时期对待富农的正确政策是(),限制富农,打击富农,中立富农,保护富农,A
61,40478,单选题,4,世界反法西斯战争又称为(),第一次世界大战,第二次世界大战,甲午战争,普法战争,B
61,55285,单选题,4,1920年3月，在北京大学成立的学习和宣传马克思主义的社团是(),新民学会,觉悟社,马克思学说研究会,马克思主义研究会,C
61,40462,单选题,4,1904年至1905年，()在中国东北爆发，这是外国侵略者为争夺在华利益而发动的战争。,日俄战争,英俄战争,德日战争,英法战争,A
61,55324,单选题,4,1935年12月，中央政治局在陕北瓦窑堡召开政治局会议系统地解决了党的(),军事路线问题,组织路线问题,政治路线问题,思想路线问题,C
61,31796,单选题,4,邓小平首次明确提出必须坚持“四项基本原则”是在(),1976年10月,1978年12月,1979年3月,1981年6月,C
61,31849,单选题,4,清朝政府宣布实行“新政”的时间是(),1901年,1906年,1908年,1911年,A
61,40323,单选题,4,我国长期是一个“万国汽车的展览馆”，先后进口和使用过130多种品牌的汽车。而解放牌汽车试制成功，结束了我国自己不能生产汽车的历史，这是在(),国民经济恢复时期,一五计划时期,文化大革命时期,改革开放时期,B
61,31878,单选题,4,镇压太平军，曾国藩奉命举办团练，募练了一支不同于绿营制度的军队，即(),常胜军,常捷军,淮军,湘军,D
61,55287,单选题,4,1950年底至1952年春，中国共产党在党政机构工作人员中开展的运动是(),肃反运动,整风、整党运动,“三反”运动,“五反”运动,C
61,40578,单选题,4,1946年6月至1947年6月，人民军队处于战略防御阶段，战争区域是(),解放区,国统区,东北解放区,中原解放区,A
61,31887,单选题,4,南通大生纱厂创办于1899年，创办人是著名的状元资本家(),张骞,张之洞,张勋,张謇,D
61,31969,单选题,4,抗日根据地建设的首要的、根本的任务是(),政权建设,经济建设,文化建设,军事建设,A
61,40503,单选题,4,1930年5月，毛泽东写了()一文，阐明了坚持辩证唯物主义的实事求是、坚持理论与实际相结合的原则的极端重要性，为中国共产党正确解决中国式的武装夺取政权的道路问题奠定了思想基础。,《中国革命战争的战略》,《中国革命和中国共产党》,《反对本本主义》,《中国的红色政权为什么能够存在？》,C
61,40620,单选题,4,中国进入新民主主义社会后，经济上处于领导地位的是(),私人资本主义经济,国家资本主义经济,国营经济,合作社经济,C
61,31923,单选题,4,武昌起义爆发于(),1911年10月1日,1912年10月1日,1911年10月10日,1912年11月10日,C
61,40557,单选题,4,毛泽东在《论持久战》中分析指出，决定抗日战争只能是持久战的因素是(),敌强我弱,敌小我大,敌退步我进步,敌寡助我多助,A
61,31955,单选题,4,在20世纪30年代前期、中期，中国共产党内屡次出现严重的“左”倾错误的主要原因是(),“八七”会议以后党内一直存在着的浓厚的“左”倾情绪,共产国际对中国共产党内部事务的错误干预和瞎指挥,党不善于把马克思列宁主义与中国实际全面地、正确地结合起来,党的主要领导人的个人专断与家长制作风,C
61,31890,单选题,4,太平天国运动最主要的历史功绩是(),加速了清王朝的衰落和崩溃,达到了中国农民战争的最高峰,打击了西方资本主义的侵略,提出了发展资本主义的方案,A
61,40515,单选题,4,遵义会议后，中共中央政治局成立了新的三人团负责红军的军事行动，其成员是(),毛泽东.朱德.周恩来,毛泽东.朱德.王稼祥,毛泽东.周恩来.王稼祥,毛泽东.张闻天.周恩来,C
61,31808,单选题,4,在抗日战争中，国民党由比较积极地抗战转向消极抗战的标志是(),国民党五届三中全会的召开,国民党五届四中全会的召开,国民党五届五中全会的召开,国民党五届六中全会的召开,C
61,31943,单选题,4,帝国主义奴役中国的社会基础是(),买办资本,封建势力,民族资产阶级,小资产阶级及其知识分子,B
61,40475,单选题,4,盟军诺曼底战役开辟了欧洲的(),第一战场,第二战场,第三战场,第四战场,B
61,40356,单选题,4,魏源在1843年编纂的《海国图志》中提出的重要思想是(),中学为体，西学为用,物竞天择，适者生存,救亡图存,师夷长技以制夷,D
61,40316,单选题,4,“火烧圆明园”这一历史事件发生在(),第一次鸦片战争期间,第二次鸦片战争期间,中法战争期间,八国联军侵华战争期间,B
61,40497,单选题,4,中共八七会议召开的地点在(),九江,汉口,武昌,上海,B
61,55278,单选题,4,《义勇军进行曲》的词作者是(),田汉,聂耳,鲁迅,瞿秋白,A
61,40464,单选题,4,武昌起义胜利后，首义官兵邀集咨议局议员和地方绅商共同商讨建立湖北革命军政府，推举()任军政府都督。,黄兴,王士祯,黎元洪,朱家宝,C
61,40486,单选题,4,中国工人阶级第一次直接同帝国主义势力进行的有组织较量是(),香港海员罢工,省港大罢工,京汉铁路上人大罢工,安源路矿工人大罢工,A
61,31721,单选题,4,1979年9月，中共十一届四中全会提出要保障基层干部和农民因时因地制宜的自主权，发挥其主动性，全会通过的决议是()。,《关于经济体制改革的决定》,《关于建国以来党的若干历史问题的决议》,《关于教育体制改革的决定》,《关于加快农业发展若干问题的决定》,D
61,40389,单选题,4,1839年，林则徐组织翻译了英国人慕瑞的《地理大全》，编成了(),《海国图志》,《四洲志》,《救亡决论》,《时局图》,B
61,40537,单选题,4,中华苏维埃第一次全国代表大会在江西省瑞金县举行的时间是(),1929年11月,1930年11月,1931年11月,1932年11月,C
61,40631,单选题,4,新中国成立之初的“过渡时期”是指(),从中华人民共和国成立到大陆全部解放,从中华人民共和国成立到国民经济恢复完成,从中华人民共和国成立到社会主义改造基本完成,从大陆统一到社会主义改造基本完成,C
61,40577,单选题,4,全面内战爆发的标志是国民党军队大举进攻(),中原解放区,山东解放区,东北解放区,西北解放区,A
61,40675,单选题,4,1934年中国工农红军第五次反“围剿”斗争失败后，率先开始战略转移的是(),红十五军团,红一方面军,红二方面军,红四方面军,B
61,40625,单选题,4,朝鲜战争爆发的时间是(),1950年,1951年,1952年,1953年,A
61,40388,单选题,4,近代中国开眼看世界的第一人是(),魏源,林则徐,龚自珍,洪仁玕,B
61,40311,单选题,4,以第一次国共合作为基础的革命统一战线正式形成的标志是(),孙中山发表《国民党宣言》,国民党一大的成功召开,中国共产党三大的召开,中共中央杭州西湖特别会议的召开,B
61,31719,单选题,4,科学评价毛泽东和毛泽东思想历史地位的是(),《关于党的若干问题的决议》,《完整准确地理解毛泽东思想》,《高举毛泽东思想旗帜，坚持实事求是的原则》,《关于建国以来党的若干历史问题的决议》,D
61,40439,单选题,4,孙中山在1894年领导建立的资产阶级革命团体是(),同盟会,华兴会,兴中会,光复会,C
61,40347,单选题,4,1949年4月23日中国人民解放军占领()，宣告国民党的反动统治覆灭。,南京,北平,重庆,武汉,A
61,31885,单选题,4,洋务运动期间，清政府派出120名幼童留美，其中有后来成为杰出铁路工程师的(),刘冠雄,唐绍仪,严复,詹天佑,D
61,40594,单选题,4,在1947年6月底揭开人民解放战争战略进攻序幕的是(),晋冀鲁豫野战军千里跃进大别山        ,西北野战军粉碎敌人的重点进攻,晋察冀野战军攻占石家庄              ,东北野战军发起辽沈战役,A
61,40657,单选题,4,“文化大革命”的导火线是(),《评新编历史剧<海瑞罢官>的发表,上海“一月革命”夺权斗争,围困中南海事件,《炮打司令部-我的一张大字报》的发展,A
61,31830,单选题,4,1990年3月，中共十三届六中全会通过了(),《关于科学技术体制改革的决定》,《关于教育体制改革的决定》,《关于加强党同人民群众联系的决定》,《关于加强党的执政能力建设的决定》,C
61,40615,单选题,4,社会主义改造是围绕着()的任务进行的，它成了社会主义建设的直接的推动力量。,社会主义工业化建设,国防现代化建设,人才培养建设,农业现代化建设,A
61,40609,单选题,4,过渡时期总路线的主要任务是(),实现社会主义工业化,实现对农业的社会主义改造,实现对手工业的社会主义改造,实现对资本主义工商业的社会主义改造,A
61,40394,单选题,4,1894年11月，孙中山创立革命团体——兴中会喊出了(),“平均地权”,“振兴中华”,“驱逐鞑虏”,“恢复中华”,B
61,40566,单选题,4,1932年4月15日，宣布对日作战的政府是(),中华苏维埃共和国临时中央政府,国民党蒋介石政府,国民党汪精卫政府,北洋军阀政府,A
61,40433,单选题,4,百日维新期间，光绪皇帝颁布的政令要求各省书院改为(),预备学校,私塾,高等学堂,专业学会,C
61,40308,单选题,4,新民主主义革命的前途是(),资本主义,社会主义,共产主义,封建主义,B
61,40636,单选题,4,通过建设社会主义的总路线是在1958年的中共()上。,八大一次会议,八大二次会议,八大三次会议,八大四次会议,B
61,40628,单选题,4,“五反”运动指的是反行贿、反偷税漏税、反盗窃国家资财、反偷工减料以()。,反浪费,反盗窃国家经济情报,反官僚主义,反贪污,B
61,40571,单选题,4,将以毛泽东为主要代表的中国共产党人把马克思列宁主义基本原理同中国具体实际相结合所创造的理论成果，正式命名为毛泽东思想，并将毛泽东思想规定为党的一切工作的指针的会议是(),中国共产党七大,中共六届六中全会,遵义会议,中共六届七中全会,A
61,40611,单选题,4,我国实施第一个五年计划的经济条件不包括(),国家财政经济根本好转,社会主义改造基本完成,工农业生产超过历史最好水平,物价稳定，物资较为充足,B
61,40487,单选题,4,第一个农民协会的地点和领导者是(),浙江省萧山县衙前村和沈定一,广东省海丰县和彭湃,湖南省韶山和毛泽东,江西省井冈山和毛泽东,A
61,40492,单选题,4,中国共产党召开的，就国共合作的方针和办法作出了正式决定的会议是(),中国共产党第一次全国代表大会,中国共产党第二次全国代表大会,中国共产党第三次全国代表大会,中国共产党第四次全国代表大会,C
61,55277,单选题,4,1950年6月，中国共产党为争取国家财政经济状况的基本好转而召开的重要会议是(),中共七届二中全会,中共七届三中全会,中共七届四中全会,中共七届五中全会,B
61,40644,单选题,4,党的十八大报告强调，我们坚定不移高举中国特色社会主义伟大旗帜，既不走封闭僵化的老路.也不走()的邪路。,封建主义,资本主义,改旗易帜,改弦更张,C
61,31815,单选题,4,中国加入世界贸易组织的时间是(),1999年12月,2000年12月,2001年12月,2002年12月,C
61,40678,单选题,4,从1937年卢沟桥事变到1938年10月广州、武汉失守，中国抗日战争处于(),战略防御阶段,战略相持阶段,战略反攻阶段,战略决战阶段,A
61,31838,单选题,4,1947年6月，晋冀鲁豫野战军挺进中原，揭开了人民解放战争(),战略防御的序幕,战略转移的序幕,战略进攻的序幕,战略决战的序幕,C
61,40568,单选题,4,1936年5月，中共中央发布《停战协议和一致抗日》通电，第一次公开把蒋介石作为联合的对象，放弃的口号是(),“反蒋抗日”,“联蒋抗日”,“逼蒋抗日”,“拥蒋抗日”,A
61,40414,单选题,4,郑观应在哪本书中提出大力发展民族工商业，同西方进行商战，设立议院，实行“君民共主”制度？(),《盛世危言》，,《海国图志》，,《四洲志》，,《天演论》,A
61,40354,单选题,4,第一个中国共产党早期组织建立于(),上海,北京,武汉,广州,A
61,40605,单选题,4,新中国建立后国民经济得到全面恢复和初步发展是在(),1953年底,1956年,1979年,1952年底,D
61,31924,单选题,4,袁世凯为首的军阀集团称(),奉系军阀,直系军阀,皖系军阀,北洋军阀,D
61,40563,单选题,4,近代中华民族反抗外敌入侵第一次取得完全胜利的民族解放战争是(),护国战争,护法战争,北伐战争,抗日战争,D
61,31875,单选题,4,促使洪秀全从村塾教师转向从事传教活动的基督教布道小册子是(),《原道救世歌》,《原道醒世训》,《盛世危言》,《劝世良言》,D
61,40604,单选题,4,新民主主义革命过程中形成和发展起来的新民主主义政治、经济、文化，都是由工人阶级领导的，因而都具有()因素。,民主主义,资本主义,新民主主义,社会主义,D
61,31872,单选题,4,20世纪以来，中国经历的第三次历史性巨变是(),辛亥革命，推翻统治中国几千年的君主专制制度,五四运动，揭开新民主主义革命的序幕,中华人民共和国的成立和社会主义制度的建立,改革开放，为实现社会主义现代化而奋斗,D
61,40583,单选题,4,1945年底爆发的一二一运动，昆明学生提出的口号是(),反对内战，争取自由,参军保田,打倒蒋介石,解放全中国,A
61,31907,单选题,4,二次革命失败的最重要原因是(),革命党人军队不足,国民党力量涣散,袁世凯军队强大,袁世凯得到帝国主义的支持,B
61,31797,单选题,4,1988年，中共中央和国务院决定建立的经济特区是(),深圳经济特区,珠海经济特区,厦门经济特区,海南经济特区,D
61,55275,单选题,4,1927年，中国共产党确定土地革命和武装反抗国民党反动派方针的会议是(),八七会议,古田会议,赣南会议,十二月会议,A
61,40324,单选题,4,鸦片战争以后，中国社会的最主要矛盾逐渐变为(),封建主义和资本主义的矛盾,封建主义和人民大众的矛盾,清政府和西方列强的矛盾,帝国主义和中华民族之间的矛盾,D
61,40554,单选题,4,1937年8月，国共两党达成协议将红军主力改编为(),国民革命军第四路军,国民革命军新编第四军,国民革命军第八路军,国民革命军新编第八军,C
61,55273,单选题,4,清王朝由强盛转向衰落是在(),乾隆朝后期,嘉庆朝中期,咸丰朝后期,同治朝中期,A
61,31934,单选题,4,新文化运动对中国革命产生的最深刻的影响是(),动摇了封建思想的统治地位,弘扬了民主和科学，推动了自然科学发展,对五四运动的爆发起了宣传作用,后期传播社会主义思想，成为知识分子拯救国家改造社会的思想武器,D
61,40538,单选题,4,中华苏维埃共和国实行的制度是(),人民代表大会制度,工农兵代表大会制度,农民代表大会制度,工人代表大会制度,B
61,40648,单选题,4,2014年10月，在福建省上杭县古田镇召开了()。,全国宣传思想工作会议,文艺工作座谈会,高校党建工作会议,全军政治工作会议,D
61,40368,单选题,4,19世纪末资本主义进入帝国主义阶段后，()成为殖民主义剥削的重要形式，并出现瓜分世界的狂潮。,商品输出,资本输出,贩卖奴隶,掠夺土地,B
61,40579,单选题,4,1947年6月，人民解放军开始战略反攻时，国民党军队正在实施的战略是(),全国进攻解放区,重点进攻山东和陕北解放区,抢占战略要地和交通线,集中兵力防守战略要地,B
61,40606,单选题,4,“一五”计划着重发展(),农业,重工业,轻工业,服务业,B
61,31856,单选题,4,毛泽东在《论人民民主专政》一文中指出，人民民主专政的主要基础是(),工人阶级和民族资产阶级的联盟,农民阶级和民族资产阶级的联盟,工人阶级和农民阶级的联盟,工人阶级和城市小资产阶级的联盟,C
61,31868,单选题,4,太平天国失败的根本原因是(),没有科学理论的指导,缺乏先进阶级的领导,无法长期保持领导集团的团结,不能正确对待传统文化,B
61,40663,单选题,4,2002年2月，江泽民在广东考察工作时提出了(),“三讲”教育的要求,“八个坚持，八个反对”的要求,“三个代表”重要思想,以“八荣八耻”为主要内容的社会主义荣辱观,C
61,31803,单选题,4,1930年8月，国民党民主人士邓演达领导成立的中间党派是(),中国青年党,中国民主同盟,中国国民党临时行动委员会,中华职业教育社,C
61,31846,单选题,4,中共十三大比较系统地阐述了(),社会主义本质理论,社会主义市场经济理论,社会主义初级阶段理论,“三个有利于”标准的理论,C
61,40642,单选题,4,“一国两制”思想的提出者是()。,邓小平,江泽民,胡锦涛,习近平,A
61,40558,单选题,4,1941年1月发生的皖南事变是国民党顽固派在抗战进入相持阶段后发动的(),第一次反共高潮,第二次反共高潮,第三次反共高潮,第四次反共高潮,B
61,40669,单选题,4,在我国农业合作化过程中，具有完全社会主义性质的经济组织形式是(),互助组,初级农业生产合作社,高级农业生产合作社,人民公社,C
61,55265,单选题,4,“能变则全，不变则亡；全变则强，小变仍亡。”提出此观点的是(),洋务派,维新派,革命派,新文化人士,B
61,40473,单选题,4,在1921年至1949年时期，中国存在着三种主要的阶级政治力量：(),工人阶级和农民阶级；城市小资产阶级；民族资产阶级,工人阶级和农民阶级；地主阶级和买办性的大资产阶级；民族资产阶级,工人阶级、农民阶级、城市小资产阶级；民族资产阶级；地主阶级和买办性的大资产阶级,工人阶级和农民阶级；城市小资产阶级；民族资产阶级；,C
61,40438,单选题,4,促使孙中山由改良走上革命道路的重大事件是(),公车上书,百日维新,中日甲午战争,八国联军侵华战争,C
61,40357,单选题,4,冷战正式开始的标志是(),丘吉尔的铁幕演说,凯南的八千字电报,杜鲁门主义的提出,朝鲜战争的爆发,C
61,40621,单选题,4,在农业合作化过程中，具有半社会主义性质的农业合作组织是(),互助组,初级农业生产合作社,高级农业生产合作社,人民公社,B
61,31800,单选题,4,标志着中国民族资产阶级开始登上政治舞台的运动是(),洋务运动,戊戌维新运动,国会请愿运动,保路运动,B
61,55322,单选题,4,《兴国土地法》对《井冈山土地法》的一个原则性修正是(),农民已经分得的田归农民个人私有，可以自主租借买卖,将“没收一切土地”改为“没收一切公共土地及地主阶级的土地”,将土地分配的原则改为以原耕地为基础，实行抽多补少、抽肥补瘦,将没收封建阶级的土地归苏维埃国家所有改为归农民个人私有,B
61,31818,单选题,4,1925年至1926年间，中国工人坚持16个月之久的罢工斗争是(),香港海员罢工,安源路矿工人罢工,京汉铁路工人罢工,省港罢工,D
61,40612,单选题,4,为我国社会主义工业化奠定初步基础的是(),社会主义国营经济的建立,第一个五年计划完成,国民经济得到恢复和发展,资本主义工商业改造完成,B
61,40618,单选题,4,社会主义改造完成之后，标志着中国进入了()社会,新民主主义社会初级阶段,新民主主义社会高级阶段,社会主义社会初级阶段,社会主义社会高级阶段,C
61,40602,单选题,4,新中国成立初期，属于私人资本主义经济向国营经济过渡的形式是(),合作社经济,国家资本主义经济,个体经济,私人资本主义经济,B
61,40635,单选题,4,毛泽东在《论十大关系》中指出，建设社会主义首先必须依靠()。,工农群众,各民主党派,各少数民族,中国共产党,A
61,40393,单选题,4,提出“物竞天择，适者生存”口号的是(),郑观应,马建忠,严复,康有为,C
61,31942,单选题,4,五四运动中起主力军作用的力量是(),中国无产阶级,爱国的青年学生,城市小资产阶级,资产阶级及其知识分子,A
61,40513,单选题,4,1931年11月，中华苏维埃共和国临时中央政府在江西瑞金成立，()当选为主席。,周恩来,毛泽东,朱德,刘少奇,B
61,40501,单选题,4,国民革命失败后，以毛泽东为代表的中国共产党人逐步将革命的重心(),由乡村转移到城市,由城市转移到乡村,由大城市转向小城市,由南方转向北方,B
61,31847,单选题,4,中国对香港恢复行使主权的时间是(),1997年7月1日,1997年12月20,1999年7月1日,1999年12月20日,A
61,40413,单选题,4,下列不属于洋务派创办的民用企业的是(),轮船招商局，,开平矿务局，,天津电报局，,金陵机器局,D
61,40603,单选题,4,开始全面建设社会主义的十年是：(),1949—1959年,1953—1953年,1955—1965年,1956—1966年,D
61,31913,单选题,4,日本侵略势力渗入中国东北地区是在(),甲午战争后,日俄战争后,皇姑屯事件后,“九一八”事变后,B
