courseId,id,subType,optionCount,subDescript,option0,option1,option2,option3,answer
61,31861,单选题,4,周恩来代表党和政府第一次提出社会主义建设“四个现代化”的目标是在(),第一届全国人民代表大会上,第二届全国人民代表大会上,第三届全国人民代表大会上,第四届全国人民代表大会上,C
61,40371,单选题,4,中英《南京条约》是在哪一年签订的？(),1840,1841,1842,1843,C
61,40646,单选题,4,2013年9月，“中国（上海）自由贸易试验区”在上海成立，运行以来取得积极进展，积累了一批可复制可推广的经验。2014年12月，国务院决定设立中国（福建）自由贸易试验区，不包括()。,福州片区,平潭片区,泉州片区,厦门片区,C
61,40629,单选题,4,1956年底，三大改造的完成标志着(),过渡时期总任务提前完成,已由农业国转变为工业国,开始进入社会主义初级阶段,国内各矛盾已消灭,C
61,40551,单选题,4,1935年，北平学生在中共号召和领导下举行的抗日救亡运动是(),五四运动,一二·九运动,一二·一运动,一二·三○运动,B
61,40470,单选题,4,压在中国人民身上的“三座大山”是指：(),帝国主义封建主义民族资本主义,封建主义帝国主义官僚资本主义,帝国主义民族资本主义官僚资本主义,帝国主义封建主义官僚资本主义,D
61,55304,单选题,4,20世纪初，邹容发表的号召人民推翻清朝统治、建立“中华共和国”的著作是 (),《驳康有为论革命书》,《革命军》 ,《警世钟》 ,《猛回头》 ,B
61,40404,单选题,4,太平天国运动之所以是中国农民战争的最高峰，最主要是因为()。,其规模和延续时间均属空前,建立了与清政府对立的政权,制定了比较完整的革命纲领,对封建王朝的打击空前沉重,C
61,40607,单选题,4,建国初的过渡时期是指(),从资本主义社会过渡到社会主义社会,从封建社会过渡到资本主义社会,从半殖民地半封建社会过渡到社会主义社会,从新民主主义社会过渡到社会主义社会,D
61,40352,单选题,4,中共八大明确提出当时党和人民的主要任务是(),正确处理人民内部矛盾,集中力量发展社会生产力,既反保守又反冒进即在综合平衡中稳步前进,反对官僚主义，宗派主义和主观主义,B
61,40499,单选题,4,中国共产党独立领导革命战争，创建人民军队和武装夺取政权的开端是党领导了(),南昌起义,秋收起义,广州起义,五卅运动,A
61,40670,单选题,4,1956年，陈云在中共八大上提出了(),“三个主体、三个补充”的思想,“双重监督”的思想,“健全法制”的思想,“新经济政策”的思想,A
61,40506,单选题,4,中共领导革命武装建立的全国第一个农村革命根据地是(),湘赣根据地,井冈山根据地,湘鄂西根据地,陕甘宁根据地,B
61,40593,单选题,4,中华人民共和国成立时，起临时宪法作用的是(),《共同纲领》,《人民政府组织法》,《论人民民主专政》,《七届二中全会决议》,A
61,31853,单选题,4,中共十七大报告指出，我国社会主义现代化建设新时期最鲜明的特点是(),与时俱进,快速发展,改革开放,以人为本,C
61,55290,单选题,4,1947年10月，被国民党当局宣布为“非法团体”并勒令取缔的民主党派是(),中国农工民主党,中国民主同盟,中国民主促进会,中国国民党革命委员会,B
61,55329,单选题,4,中国革命的主要斗争形式是  (),议会斗争  ,经济斗争 ,武装斗争  ,文化斗争,C
61,40610,单选题,4,我国大规模的有计划的社会主义建设开始的标志是(),三大改造的开始,土地改革的完成,“一五”计划的制定与实施,“三反”.“五反”运动的开展,C
61,31850,单选题,4,1919年6月3日后，五四运动主力发生的变化是(),由学生转为工人,由工人转为学生,由农民转为工人,由工人转为农民,A
61,31906,单选题,4,下列关于辛亥革命历史意义的表述，不正确的一项是(),推翻了清王朝，结束了中国两千多年的封建制度,打击了帝国主义侵略势力，使其难以在中国建立稳定的统治秩序,为民族资本主义的发展创造了条件,使民主共和观念深入人心,B
61,31857,单选题,4,1917年，孙中山领导发动了反对北洋军阀的(),“二次革命”,护国运动,第一次护法运动,第二次护法运动,C
61,40365,单选题,4,近代中国最革命的阶级是(),中国农民阶级,中国资产阶级,中国工人阶级,中国小资产阶级,C
61,40633,单选题,4,全国土地改革以后分配给农民的土地(),归乡镇所有,归农民所有,归集体所有,归国家所有,B
61,40556,单选题,4,中国共产党在1937年8月召开的洛川会议上通过了(),《为抗日救国告全国同胞书》,《停战议和一致抗日通电》,《致国民党五届三中全会电》,《中国共产党抗日救国十大纲领》,D
61,40426,单选题,4,谭嗣同在戊戌维新期间撰写的宣传变法维新的著作是(),《新学伪经考》,《变法通议》,《日本变政考》,《仁学》,D
61,40322,单选题,4,区别新民主主义革命与旧民主主义革命的根本标志是：(),革命指导思想不同,革命前途不同,革命领导阶级不同 ,革命对象不同,C
61,40504,单选题,4,中国的武装斗争的实质是(),无产阶级领导下的农民战争,无产阶级领导下的工人罢工,无产阶级领导下的学生运动,无产阶级领导下的商人罢市,A
61,55289,单选题,4,1999年12月20日，中国在推进祖国统一大业方面迈出的重要一步是(),海峡两岸达成“九二共识”,海峡双边举行“汪辜会谈”,恢复对香港行使主权,恢复对澳门行使主权,D
61,40569,单选题,4,1941年1月，国民党发动第二次反共高潮，在安徽泾县以8万余兵力包围袭击新四军军部及所属部队9千多人，蒋介石还诬称新四军“叛变”，宣布取消新四军番号。这就是国民党制造的(),华北事变,皖南事变,北京事变,七七事变,B
61,40586,单选题,4,辽沈.淮海.平津三大战役进行的时间是(),1947年12月——1949年2月,1948年5月——1949年1月,1948年6月——1949年8月,1948年9月——1949年1月,D
61,31874,单选题,4,百日维新中，光绪皇帝颁布的政令要求裁减旧式绿营兵，改练(),新式海军,新式陆军,新式炮兵,新式骑兵,B
61,40427,单选题,4,梁启超撰写的宣传变法维新主张的著作是(),《新学伪经考》,《变法通议》,《日本变政考》,《仁学》,B
61,55294,单选题,4,天京变乱说明的本质问题是()   ,农民小生产者的局限性   ,洪秀全等人此时已腐化,太平天国开始由盛转衰   ,统治阶级内部争权夺利,A
61,40392,单选题,4,严复1898年翻译出版的《天演论》所宣传的思想是(),师夷长技以制夷,中学为体，西学为用,振兴中华,物竞天择，适者生存,D
61,40318,单选题,4,毛泽东提出“以后要非常注意军事，须知政权是由枪杆子中取得的”的重要论断是在(),北京特别会议,八七会议,遵义会议,古田会议,B
61,40349,单选题,4,蒋介石和毛泽东碰杯的这张历史照片，一度使中国人看到和平建国的曙光，这张历史照片反映的历史事件是(),国共合作,南北议和,重庆谈判,北平谈判,C
61,40366,单选题,4,允许外国人在中国开办工厂的条约是(),《南京条约》,《天津条约》,《马关条约》,《辛丑条约》,C
61,55288,单选题,4,1990年，邓小平提出的关于中国农业改革与发展的思想是(),“三个主体，三个补充”,“三步走”,“两个飞跃”,“两个大局”,C
61,55297,单选题,4,洋务运动后期，洋务派打出的旗号是  (),“师夷长技以制夷”    ,“自强”  ,“扶清灭洋”   ,“求富”,D
61,40666,单选题,4,“文化大革命”结束的标志是(),天安门事件的发生,林彪反革命集团被粉碎,江青反革命集团被粉碎,全面整顿的开始,C
61,31877,单选题,4,太平天国定都天京后颁布的《天朝田亩制度》并不可行，因此实际实行的是(),厘金制度,照旧交粮纳税,国库供养制,按“值百抽五”纳税,B
61,31841,单选题,4,1956年召开的中共八大指出，党和全国人民当前的主要任务是(),正确处理人民内部矛盾,实现社会主义四个现代化,把我国推进到社会主义社会,把我国从落后的农业国变为先进的工业国,D
61,40651,单选题,4,改革开放以来我们取得一切成绩和进步的根本原因，归结起来就是：开辟了中国特色社会主义道路，形成了中国特色社会主义理论体系，确立了()。,中国特色社会主义旗帜,中国特色社会主义制度,中国特色社会主义目标,中国特色社会主义方向,B
61,31723,单选题,4,中共十三大制定的“三步走”战略部署第三步目标是指()。,国民生产总值比1980年翻一番，解决人民温饱。,到21世纪中叶，人均国民生产总值达到中等发到国家水平，人民生活比较富裕，基本实现现代化。,到20世纪末，国民生产总值再翻一番，人民是生活达到小康水平。,到21世纪中叶，使中国跻身发达国家行列。,B
61,55317,单选题,4,大革命的主要斗争形式是(),革命战争,工人运动,农民运动,民众运动,A
61,40665,单选题,4,毛泽东在《论十大关系》中提出，处理中国共产党和民主党派关系的方针是(),长期共存，互相监督,以诚相待，患难与共,肝胆相照，荣辱与共,同甘共苦，同舟共济,A
61,40455,单选题,4,在20世纪初出现的资产阶级革命组织中，哪一个组织是孙中山领导的第一个资产阶级革命政党(),中国国民党 ,兴中会,同盟会  ,光复会,C
61,31851,单选题,4,台湾人民反抗国民党当局暴政的“二二八”起义发生在(),1946年,1947年,1948年,1949年,B
61,40359,单选题,4,“我获得了一个不值得羡慕的名声：我是美国历史上第一个在没有取得胜利的停战协定上签字的司令官。”美国将军克拉克这段话是针对(),越南战争,朝鲜战争,太平洋战争,中印战争,B
61,31864,单选题,4,1945年4月，包括中国解放区代表董必武在内的中国代表团出席了(),《联合国家宣言》签署会议,德黑兰会议,雅尔塔会议,联合国制宪会议,D
61,31832,单选题,4,19世纪初，大肆向中国走私鸦片的主要国家是(),美国,英国,日本,俄国,B
61,40626,单选题,4,“五反”运动发起的时间是(),1952年上半年,1952年下半年,1953年上半年,1953年下半年,A
61,55291,单选题,4,2013年11月，作出《关于全面深化改革若干重大问题的决定》的会议是(),中共十八届一中全会,中共十八届二中全会,中共十八届三中全会,中共十八届四中全会,C
61,55315,单选题,4,宋庆龄说：“孙中山和共产党之间具有历史意义的合作不是偶然的，它是当时的国际局势和中国本身的内部条件造成的。”这里说的“内部条件”，主要是指(),“一战”后，中国民族工业重新受到列强压制,“打倒列强，除军阀”成为全国人民的共同心愿,中国共产党总结了经验教训，正在积极寻找同盟者,国民党是中国各政党中比较革命的民主派,B
61,40671,单选题,4,1961年1月，中共中央正式决定对国民经济实行“调整、巩固、充实、提高”方针的会议是(),中共八届五中全会,中共八届六中全会,中共八届九中全会,中共八届十中全会,C
61,31884,单选题,4,洋务派兴办的近代企业中，由官办转向官督商办的第一个企业是(),轮船招商局,开平矿务局,上海机器织布局,天津电报局,A
61,55298,单选题,4,洪秀全创立拜上帝教，其理论特点是  (),把西方基督教教义同中国农民平均主义结合起来  ,把西方资本主义的政治学说同传统的儒家思想相结合  ,把西方基督教教义、中国儒家大同思想和农民平均主义结合起来 ,把西方资本主义的政治学说同中国农民平均主义结合起来,C
61,40548,单选题,4,1937年12月，在日本侵略军制造的“南京大屠杀”中惨遭屠杀的中国军民达(),10万人以上,15万人以上,20万人以上,30万人以上,D
61,40449,单选题,4,兴中会的革命纲领包括(),统一中国,稳定物价,创立合众政府,平均地权,C
61,40505,单选题,4,中国民主革命走向胜利的主要战略基地是(),城市,农村,大城市,沿海城市,B
61,40590,单选题,4,人民民主专政的基础是(),工人阶级.农民阶级和城市小资产阶级的联盟,工人阶级与民族资产阶级的联盟,工人阶级与大资产阶级的联盟,工人阶级与地主阶级的联盟,A
61,55293,单选题,4,“用大刀、肉体和联军相搏，虽然被联军打死了几万人，伤亡枕籍，还是前仆后继，其勇锐之气殊不可当，真是令人惊奇佩服。所以经过那次血战之后，外国人才知道中国还有民族思想，这种民族是不可消灭的”。这句话反映的历史事件是(),太平天国运动   ,三元里人民的抗英斗争,黄花岗起义     ,义和团运动,D
61,40659,单选题,4,1948年秋，中国人民解放军进行战略决战的第一个战役是(),辽沈战役,淮海战役,平津战役,渡江战役,A
61,40482,单选题,4,1919～1949新中国成立以前，中国社会的性质是：(),封建社会,半殖民地半封建社会,社会主义社会,资本主义社会,B
61,55312,单选题,4,下列不属于三民主义内容的是()   ,民族主义  ,民权主义  ,民生主义  ,民主主义,D
61,40496,单选题,4,以蒋介石为代表的南京国民党政府的性质是(),资产阶级政权,小资产阶级政权,大地主大资产阶级政权,封建君主专制政权,C
61,55303,单选题,4,旧民主主义革命时期中国反侵略斗争失败的根本原因是 (),经济技术落后,社会制度腐败 ,思想文化保守,军事指挥失误 ,B
61,31961,单选题,4,王明“左”倾教条主义的表现主要是照搬苏联的(),农村暴动模式,水兵起义模式,城市中心模式,武装斗争模式,C
61,55307,单选题,4,史称“黄花岗起义”的1911年4月广州起义的领导人是(),黄兴,孙中山,宋教仁,章炳麟,A
61,40476,单选题,4,国民革命军于1926年开始的北伐战争，在人民的支持下，基本上击溃了(),北洋军阀的主力,淮军的主力,湘军的主力,东北军的主力,A
61,55271,单选题,4,在“改革、发展、稳定”三者的关系中，“稳定”的地位和作用是()。,关键,动力,目标,前提,D
61,31826,单选题,4,1959年，在中共中央召开的庐山会议上受到错误批判的是(),刘少奇,彭德怀,周恩来,邓小平,B
61,40363,单选题,4,帝国主义列强对中国的争夺和瓜分达到高潮是在(),鸦片战争爆发后,中日甲午战争爆发后,第二次鸦片战争爆发后,中法战争爆发后,B
61,55283,单选题,4,1924年11月，出任黄埔军校政治部主任的是(),周恩来,廖仲恺,邓演达,聂荣臻,A
61,40562,单选题,4,1945年4月，中国共产党通过《关于若干历史问题的决议》的会议是(),中共六届四中全会,中共六届五中全会,中共六届六中全会,中共六届七中全会,D
61,40489,单选题,4,成为国共合作的政治基础和革命统一战线的共同纲领是(),旧三民主义,中国共产党的最低纲领,新三民主义,《孙文越飞宣言》,C
61,40390,单选题,4,魏源编纂的综述世界各国历史.地理及中国应采取的对外政策的书(),《海国图志》,《四洲志》,《救亡决论》,《时局图》,A
61,40658,单选题,4,1964年，新中国取得的重大科技成果是(),第一颗原子弹试验成功,第一颗氢弹试验成功,第一台万吨水压机试制成功,第一颗人造卫星发射成功,A
61,40570,单选题,4,毛泽东明确提出“马克思主义的中国化”命题的会议是(),瓦窑堡会议,洛川会议,遵义会议,六届六中全会,D
61,55314,单选题,4,著名学者胡绳说：“近代中国在20世纪初处于一个社会大变革时期，中国民主主义革命向新民主主义革命转折，这是诸多因素共同作用的结果.”下列诸多因素中起决定作用的是(),中国民族资本主义的发展,中国无产阶级的壮大,俄国十月革命的影响,马克思主义的传播,B
61,40528,单选题,4,毛泽东首次明确提出建立工农政权的思想是在:(),八七会议后,秋收起义后,南昌起义后,广州起义后,B
61,40410,单选题,4,洋务派兴办的军用工业采用哪种方式办理(),官办，,商办，,官商合办，,官督商办,A
61,40412,单选题,4,洋务运动时期，清政府在哪一年派出第一批留学生出洋留学(),1870，,1871，,1872，,1873,C
61,40339,单选题,4,被毛泽东称为“开天辟地的大事变”历史事件是(),辛亥革命的爆发,五四运动的爆发,中国共产党的建立,俄国十月革命的爆发,C
61,40453,单选题,4,1894年孙中山到檀香山组建了第一个资产阶级革命团体，立誓“驱除鞑虏，恢复中国，创立合众政府”，这个团体是(),华兴会  ,光复会  ,兴中会  ,同盟会,C
61,40649,单选题,4,2015年3月，国家发改委.外交部.商务部联合发布了《推动共建丝绸之路经济带和21世纪海上丝绸之路的愿景与行动》，在这一纲领性文件中，分列“一带一路”陆海两大核心区的是()。,新疆与浙江,新疆与福建,内蒙与广东,内蒙与上海,B
61,40587,单选题,4,1949年4月21日，发布《向全国进军的命令》的领导人是(),毛泽东与周恩来,毛泽东与朱德,刘伯承与邓小平,邓小平与罗荣桓,B
61,40564,单选题,4,1945年8月9日，在抗日战争胜利之际发表《对日寇的最后一战》声明的是(),毛泽东,朱德,彭德怀,刘伯承,A
61,40373,单选题,4,规定割让香港岛的不平等条约是(),《南京条约》,《虎门条约》,《天津条约》,《北京条约》,A
61,55302,单选题,4,《天朝田亩制度》和《资政新篇》中关于社会经济的主张() ,互相矛盾 ,大同小异,完全一致 ,互为补充,A
61,40525,单选题,4,标志着中国共产党进入创建红军新时期的著名起义依次是(),南昌起义；广州起义；秋收起义,南昌起义；秋收起义；广州起义,南昌起义；秋收起义；平江起义,秋收起义；南昌起义；广州起义,B
61,40662,单选题,4,1948年11月至1949年1月，担任淮海战役总前委书记的是(),邓小平,刘伯承,陈毅,粟裕,A
61,55286,单选题,4,1920年11月，中国共产党早期组织领导建立的第一个产业工会组织是(),安源路矿工人俱乐部,上海机器工会,北京长辛店工人俱乐部,京汉铁路总工会,B
61,31957,单选题,4,“因为中国资产阶级根本上与剥削农民的豪绅地主相联结相混和，中国革命要推翻豪绅地主阶级，便不能不同时推翻资产阶级。”材料中表述的这一观点的主要错误是(),忽视了反对帝国主义的必要性,未能区分中国资产阶级中的两个部分,混淆了民主革命和社会主义革命的任务,把资产阶级也当做革命的对象,C
61,40518,单选题,4,1935年1月召开的遵义会议解决了当时最为迫切的:(),政治问题和组织问题,军事问题和组织问题,思想问题和组织问题,思想问题和作风问题,B
61,40561,单选题,4,在抗日战争时期，中国共产党开展延安整风运动最主要的任务是(),反对主观主义以整顿学风,反对宗派主义以整顿党风,反对官僚主义以整顿作风,反对党八股以整顿文风,A
61,40374,单选题,4,以下哪个城市不是《南京条约》规定的通商口岸(),福州,上海,厦门,天津,D
61,40372,单选题,4,中国的关税自主权开始遭到破坏的条约是(),《北京条约》,《天津条约》,《马关条约》,《南京条约》,D
61,55272,单选题,4,1966年至1976年间在我国发生的全局性、长时间的“左”倾严重错误是(),“大跃进”,人民公社运动,反右派斗争扩大化,“文化大革命”,D
61,40660,单选题,4,1941年3月，在抗日民主运动中成立的民主党派是(),中国国民党临时行动委员会,中国青年党,中国国家社会党,中国民主政团同盟,D
61,55331,单选题,4,标志着日本企图变中国为其独占殖民地阶段开始的严重事件是(),“九一八”事变,华北事变,卢沟桥事变,“一．二八”事变,A
61,55328,单选题,4,中国共产党建立工农苏维埃政权是在 ()  ,国民革命时期  ,土地革命战争时期 ,抗日战争时期  ,解放战争时期,B
61,31718,单选题,4,中国改革开放新时期到来的标志是()。,粉碎“四人帮”,中共十一大重新提出四个现代化的奋斗目标,中共十一届三中全会,经济体制改革的全面展开,C
61,31893,单选题,4,百日维新后，新政措施大都被废除，除了(),奖励新著     ,奖励创办报刊,京师大学堂   ,准许自由组织学会,C
61,31873,单选题,4,2001年，中国对外开放进入一个新阶段的标志是(),开放十四个沿海港口城市,设立海南经济特区,开发和开放上海浦东新区,进入世界贸易组织,D
61,40555,单选题,4,1939年1月，国民党五届五中全会的召开标志着国民党(),由消极抗战逐步转变为积极抗战,由全面抗战逐步转变为片面抗战,由片面抗战逐步转变为消极抗战,由片面抗战逐步转变为全面抗战,C
61,31915,单选题,4,1903年，章炳麟和邹容先后入狱是因为(),自立军起事失败,天津教案,惠州起义失败,苏报案,D
61,40420,单选题,4,北洋水师正式成立时间为(),1886年，,1887年，,1888年，,1889年,C
61,31956,单选题,4,中国工农红军三大主力长征胜利结束的标志性事件是(),井冈山会师,懋功会师,吴起镇会师,会宁、静宁将台堡会师,D
61,31858,单选题,4,五四运动爆发的直接导火线是(),北洋军阀接受日本提出的“二十一条”,北洋军阀与日本签订“西原借款”合同,巴黎和会上中国外交的失败,华盛顿会议上中国外交的受挫,C
61,40638,单选题,4,党的“十五大”召开的时间是()。,1990,1992,1997,2002,C
61,40452,单选题,4,被称为政治革命，内容是“创立民国”，即推翻封建君主专制制度，建立资产阶级民主共和国的是(),民权主义,民生主义,民族主义,民主主义,A
61,31925,单选题,4,20世纪中国的第一次历史性巨变是(),太平天国运动,义和团运动,戊戌变法,辛亥革命,D
61,40381,单选题,4,基督教在中国设立的最大出版机构广学会发行的报刊是(),《中国丛报》,《北华捷报》,《子林西报》,《万国公报》,D
61,40581,单选题,4,1947年中共中央召开全国土地会议，制订《中国土地法大纲》的地点是(),陕北米脂县杨家沟,陕北瓦窑堡,河北平山县,江西井冈山,C
61,40516,单选题,4,奠定新型人民军队的基础并由此开始确立了党指挥枪的原则是在(),八七会议,秋收起义,三湾改编,古田会议,C
61,40423,单选题,4,下列历史人物中，不属于资产阶级维新派代表人物的是(),康有为,谭嗣同,梁启超,张之洞,D
61,31833,单选题,4,20世纪初，在民主革命思想传播中发表《警世钟》的是(),章炳麟,邹容,陈天华,孙中山,C
61,40436,单选题,4,戊戌维新运动的性质是(),资产阶级革命运动,资产阶级改良运动,地主阶级自救运动,地主阶级改革运动,B
61,40447,单选题,4,民国初年两次帝制复辟失败的共同原因是(),资产阶级力量强大,孙中山高举反复辟旗帜,北洋军阀内部矛盾激化,经过辛亥革命民主共和的观念深入人心,D
61,40377,单选题,4,1894年11月，日军制造的连续4天大屠杀，造成2万中国居民死亡的是(),江东六十四屯惨案,旅顺大屠杀惨案,济南惨案,大连大屠杀惨案,B
61,40376,单选题,4,规定中国割让九龙半岛南端和昂船洲，“归英属香港界内”的条约是(),《北京条约》,《南京条约》,《黄埔条约》,《望厦条约》,A
61,40353,单选题,4,武昌起义后，被推举为湖北军政府都督的是(),黄兴,黎元洪,蔡锷,孙中山,B
61,55327,单选题,4,1927年4月建立的国民党南京政府所代表的阶级是 (),工人阶级  ,地主阶级和买办性的大资产阶级 ,农民阶级  ,民族资产阶级和城市小资产阶级,B
61,55330,单选题,4,在大革命失败后，中国革命之所以能够得到坚持和发展，根本的原因是  (),工作重心转移到农村  ,创建了新型的人民军队 ,取得了反“围剿”的胜利  ,领导农民进行了土地革命,D
61,40622,单选题,4,我国进入社会主义社会的最主要标志是(),中华人民共和国的成立,发展国民经济第一个五年计划的制定,第一届全国人民代表大会的召开,社会主义改造的完成,D
61,40530,单选题,4,公开打出了“工农革命军”的旗帜的起义是:(),秋收起义,南昌起义,广州起义,三湾改编,A
61,55323,单选题,4,毛泽东所说的中国文化革命的伟人是指(),瞿秋白,鲁迅,陈独秀,郭沫若,B
61,40471,单选题,4,中国的资产阶级分成了两个部分：(),中国的民族资产阶级；中国的城市小资产阶级,中国的城市小资产阶级；上层小资产阶级,中国的民族资产阶级；依附于外国垄断资本的买办性的大资产阶级,中国的城市小资产阶级；上层小资产阶级,C
