courseId,id,subType,optionCount,subDescript,option0,option1,option2,option3,answer
9,2451,单选题,4,下面不属于科学社会主义诞生的重大意义是（     ),敲响了资本主义的丧钟,使工人阶级拥有了反对资产阶级的强大思想武器,指引一些国家的工人阶级进行革命，在本国建立了社会主义制度,资本主义在全世界的消亡成为现实,D
9,7190,单选题,4,恩格斯指出：“社会上一旦有技术上的需要，则这种需要会比十所大学更能把科学推向前进。”这在认识论上说明（ ）,实践是认识的来源,科学技术的发展超过了社会实践的发展速度,实践是认识发展的动力,技术推动了科学的发展,C
9,23994,单选题,4,社会规律与自然规律的区别是（）,前者是主观的，后者是客观的,前者是人造的，后者是自然界固有的,前者通过人的自觉活动而实现，后者自发地起作用,前者可以被我们废弃和改变，后者无法废弃和改变,C
9,2320,单选题,4,经济全球化的实质是（     ）,市场交换的国际化,资源配置的国际化,生产经营的国际化,科技发展的国际化,B
9,7169,单选题,4,“两个必然”和“两个决不会”( ),是矛盾的,是两回事,是有着内在联系的,是内容和形式的关系,C
9,24004,单选题,4,“经济上落后的国家在哲学上仍然能够演奏第一提琴”说明（）,社会存在决定社会意识,社会意识具有历史继承性,社会意识对社会存在具有反作用,社会意识与社会经济发展水平的不平衡性,D
9,1685,单选题,4,经济基础是（　　　　）,一定历史阶段上生产力和生产关系的总和,一定历史阶段上生产力和生产关系的总和,一定历史阶段上科学技术和经济管理的总和,一段历史阶段上占统治地位的生产关系各方面的总和,D
9,2168,单选题,4,马克思对商品价值理论的分析，告诉我们（     ）,商品价值是人类社会一开始就有的,商品价值是自然赋于的属性,商品价值是在物的外壳掩盖下的生产关系,商品价值与生产关系无关,C
9,6946,单选题,4,中国古代哲学家公孙龙“白马非马”之说的错误在于割裂了 ( ),内因和外因的关系,矛盾统一性和斗争性的关系,矛盾主要方面和次要方面的关系,矛盾的普遍性和特殊性的关系,D
9,7029,单选题,4,我国的国体是（  ）,人民代表大会制度,人民民主专政,民主共和制,人民民主统一战线,B
9,1861,单选题,4,在马克思主义理论体系中，科学社会主义是其(    ),理论基础,核心内容,指导原则,前提条件,B
9,6903,单选题,4,驳斥不可知论最有力的论据是（）,社会实践可以证明人们能正确认识世界,物质是可以通过感觉感知的,人可以透过现象揭示本质,感性认识可以上升为理性认识,A
9,7020,单选题,4,自然科学属于生产力范畴，这是因为（ ）,它是对自然界的现象及其发展规律的正确认识,它能把生产力系统中的各要素组合成统一整体,它渗透到生产力诸要素中并转化为现实生产力,它是构成现代生产力系统的最重要的独立因素,C
9,10870,单选题,4,马克思主义对未来社会的展望之所以是科学的，是因为（  ）,马克思主义对未来社会的描述更具体和详尽,马克思主义对未来社会的向往更真挚和热烈,马克思主义对未来社会的展望更具有号召力,马克思主义是在揭示人类社会发展一般规律的基础上展望未来,D
9,2224,单选题,4,资本主义扩大再生产的重要源泉是（    ）,剩余价值,资本积累,资本集中,资本有机构成的提高,A
9,6897,单选题,4,划分唯物史观与唯心史观的根据是（）,是否承认社会历史的规律性,是否承认阶级斗争,是否承认社会存在决定社会意识,是否承认社会意识的能动作用,C
9,6943,单选题,4,既是自然界与人类社会分化统一的历史前提，又是自然界与人类社会统一起来的现实基础( ),运动,实践,精神生产,物质生产,B
9,7137,单选题,4,社会主义的根本任务是( ),进行阶级斗争,改革生产资料所有制,进行政治体制改革、经济体制改革,解放生产力、发展生产力,D
9,2166,单选题,4,商品生产者实现私人劳动转化为社会劳动必须通过（     ）,商品购买,商品生产,商品销售,商品分配,C
9,1830,单选题,4,一些自然科学家没有学习马克思主义，也取得了伟大的科学成就，这是因为他们（   ）,完全依靠个人的天才条件,摆脱了哲学的指导,具有对科学的浓厚兴趣,自觉不自觉地在科学研究中体现唯物论和辩证法的原则,D
9,2250,单选题,4,资本主义经济危机呈现出周期性的原因在于（    ）,资本主义基本矛盾运动的波动性,资本主义基本矛盾运动的阶段性,资本主义基本矛盾运动的周期性,资本主义再生产的周期性,B
9,7119,单选题,4,各国垄断组织从经济上瓜分世界产生了( ),国家垄断资本主义,国际垄断同盟,金融资本和金融寡头,殖民地和宗主国,B
9,24094,单选题,4,认识的主体不包括（）,个体,群体,企业主体,人类群体,C
9,7003,单选题,4,“追求真理比占有真理更宝贵”所包含的哲理是（ ）,认识经历着从感性认识到理性认识的发展,认识的根本任务是通过现象认识本质,认识不能停滞，而应该不断扩展和深化,改造世界比认识世界更重要,C
9,7160,单选题,4,无产阶级专政的实质，就是( ),无产阶级作为统治阶级掌握国家政权,要消灭剥削、消灭阶级，进到无阶级社会,镇压敌对阶级的反抗和破坏活动,领导和组织社会主义建设,A
9,79399,单选题,4,“必然王国”和“自由王国”是历史性概念，它是指社会活动的（）,两条不同的道路,两个不同的模式,两种不同的选择,两种不同的状态,D
9,2418,单选题,4,列宁指出：“马克思丝毫不想制造乌托邦，不想凭空猜测无法知道的事情。马克思提出共产主义的问题，正像一个自然科学家已经知道某一新的生物变种是怎样产生以及朝哪个方向演变才提出该生物变种的发展问题一样。”这表明马克思（    ),立足于揭示未来社会的一般特征,对未来社会不作详尽的细节描绘,在剖析资本主义社会旧世界中阐发未来新世界的特点,在揭示人类社会发展一般规律的基础上指明社会发展的方向,D
9,2397,单选题,4,坚持四项基本原则的核心是（     ),坚持社会主义道路,坚持马列主义、毛泽东思想,坚持党的领导,坚持人民民主专政,C
9,1767,单选题,4,资本社会化的最高形式是（ ）,垄断资本主义,国家垄断资本主义,生产社会化,经营管理社会化,B
9,1656,单选题,4,“真理是思想形式，是人类经验的组织形式。”这是（      ）,唯物主义客观真理观,辩证真理观,唯心主义主观真理观,形而上学真理观,C
9,10207,单选题,4,共产主义社会的生产资料所有制是（  ）,生产资料的单一社会公有制,多种形式的生产资料公有制并存,公有制和非公有制经济形式并存,生产资料的个人和公共所有并存,A
9,7128,单选题,4,正确认识资本主义的历史过渡性要( ),否定资本主义生产关系的一切改良,对资本主义采取全面肯定的态度,借鉴资本主义社会中反映人类文明进步的改良,借鉴并发展资本主义的经济制度,C
9,7062,单选题,4,阶级斗争对阶级社会发展的推动作用突出表现在(    ),生产力的发展,生产关系的变革,社会形态的更替,科技的进步,C
9,6905,单选题,4,下列选项中，正确表述认识客体的含义的是（ ）,认识的客体是主体创造出来的对象,认识的客体是外部自然界,认识的客体是客观存在的事物,认识的客体是主体实践和认识的对象,D
9,6920,单选题,4,“人有多大胆，地有多大产；不怕办不到，就怕想不到；只要想得到，啥也能办到。”这是（ ）,主张充分发挥意识能动作用的观点,主观唯心主义的观点,客观唯心主义的观点,朴素唯物主义的观点,B
9,7206,单选题,4,所谓客观真理，主要是指（ ）,客观事实和客观规律,主观对客观的反映,人的认识对象的客观属性,人的正确认识中所含有的客观内容,D
9,7143,单选题,4,列宁得出社会主义可能在一国或数国首先取得胜利的结论依据是( ),资本主义必然灭亡、社会主义和共产主义必然胜利的规律,帝国主义时代资本主义政治经济发展不平衡的规律,资本主义国家无产阶级与资产阶级斗争的规律,无产阶级是最先进、最革命的阶级的原理,B
9,1783,单选题,4,人类进入21世纪，英国广播公司(BBC)在全球范围内进行“千年思想家”网评，名列榜首的是(    ),马克思,爱因斯坦,达尔文,牛顿,A
9,7193,单选题,4,辩证唯物主义认识论在实质上是与唯心主义先验论对立的（ ）,感觉论,反映论,经验论,实践论,B
9,7178,单选题,4,实践的主体是（ ）,绝对精神,具有思维能力从事社会实践和认识活动的人,人,人的意识,B
9,24128,单选题,4,垄断资本输入到发展中国家会造成一系列不利影响，但其中不包括（）,环境污染、能源枯竭,民族工业受到严重冲击,对国际资本依赖性增加,宗教、民族冲突加剧,D
9,1664,单选题,4,有人认为只有写到书本上的理论才是真实可靠的，便不顾实际情况，生搬硬套书本上的理论。这犯了（  　　）错误。,唯心主义先验论,直观被动反映论,教条主义,经验主义,C
9,23464,单选题,4,生产力范畴反映的是（）,人与社会之间的关系,人与自然之间的关系,人与人之间的社会关系,人与劳动资料之间的关系,B
9,1797,单选题,4,下列选项属于马克思主义三个主要组成部分之一的是（   ）,马克思主义政治学,科学社会主义,马克思主义伦理学,空想社会主义,B
9,23473,单选题,4,美国跨越了奴隶社会和封建社会，从原始社会直接过渡到资本主义社会。这说明（）,五种社会形态划分的理论是错误的,社会形态的更替没有规律可以遵循,它的发展违背了历史发展的客观规律,它的发展是以世界范围内五种社会形态依次更替为前提的,D
9,2393,单选题,4,19世纪初，(   )试图建立“和谐公社”，其思想更具有探索试验的特性，,巴贝夫,傅立叶,圣西门,欧文,D
9,6949,单选题,4,主观辩证法与客观辩证法的关系是( ),反映与被反映的关系,唯心主义与唯物主义的关系,抽象与具体的关系,唯心辩证法与唯物辩证法的关系,A
9,1567,单选题,4,在生产关系中起决定作用的是（　　）,生产资料所有制,产品的分配和交换,在生产中人与人的关系,管理者和生产者的不同地位,A
9,6872,单选题,4,马克思主义，从广义上说是 ( ),不仅指马克思恩格斯创立的基本理论、基本观点和学说的体系，也包括继承者对它的发展,无产阶级争取自身解放和整个人类解放的学说体系,关于无产阶级斗争的性质、目的和解放条件的学说,马克思和恩格斯创立的基本理论、基本观点和基本方法构成的科学体系,A
9,10135,单选题,4,中国古代佛教理论家惠能认为“不是幡动，不是风动，仁者心动”这是（ ）,客观唯心主义,主观唯心主义,形而上学观点,辩证法观点,B
9,24016,单选题,4,现代生产力系统要素中的渗透性因素主要是（）,劳动对象,生产工具,自然科学,科学技术,C
9,6956,单选题,4,实践的客体是( ),绝对精神的对象化,客观物质世界,人的意识的创造物,进入主体的认识和实践范围的客观事物,D
9,24118,单选题,4,关于人的价值的正确观点是（）,人的自我价值就在人本身，人生来都有平等的价值,人的自我价值就在于自由，它是通过人的自由选择实现的,人的自我价值在于采取必要手段赢得一定的社会地位,人的自我价值在于社会对个人的尊重和满足,D
9,1578,单选题,3,人民群众既是历史的“剧中人”，又是历史的“剧作者”，这是（　　）,折中主义的观点,历史唯物主义的观点,历史循环论的观点,,B
9,1778,单选题,4,资本主义的历史进步性不能掩盖其自身的局限性，其因在于(    ),资本主义主要矛盾阻碍社会生产力的发展,资本主义制度下财富占有两极分化，引发经济危机,资本家支配整个政治和军事机器，不断对外侵略扩张,资本主义选举的虚伪性,B
9,1835,单选题,4,哲学史上第一个以唯心主义的形式系统地、有意识地叙述辩证法的基本规律的哲学家是（   ）,费尔巴哈,谢林,培根,黑格尔,D
9,6977,单选题,4,列宁说：“没有革命的理论，就不会有革命的行动”，这一命题的含义是 ( ),革命理论比革命行动更重要,革命运动是革命理论的派生物,革命理论对革命实践具有指导作用,革命理论最终决定革命运动的成败,C
9,1761,单选题,4,资本主义必然为社会主义所代替，意味着（    ）。,资本主义社会将在短期内会自行消亡,资本主义制度已经不再能为生产力的发展提供了动力,资产阶级已经不再阻挠向社会主义的转变,资本主义向社会主义过渡必然是一个复杂的、长期的历史过程,D
9,22637,单选题,4,从不同角度，可以对什么是马克思主义作出不同回答。认为马克思主义是由马克思和恩格斯创立的，由其后各时代、各个民族的马克思主义者不断丰富和发展的观点和学说体系，这是（）,从理论的创造者、继承者的认识成果角度形成的回答,从理论的阶级属性角度形成的回答,从理论的研究对象和主要内容角度形成的回答,从理论品质角度形成的回答,A
9,23996,单选题,4,下列属于非意识形态的是（）,道德,哲学,艺术,语言学,D
9,2189,单选题,4,假定每1元货币，在一定时间内平均流通四次，要使10000亿元的商品成交，流通中时间需要的货币量应是（     ）,1000亿元 ,4000亿元   ,5000亿元 ,2500亿元,D
9,7024,单选题,4,阶级划分的主要标志是各种社会集团（）,在国家政权中的地位不同,对生产资料的关系不同,在社会劳动组织中的作用不同,取得劳动产品的方式和多寡不同,B
9,6915,单选题,4,时间具有一维性，这是指它的（  ）,可变性,无限性,不可逆性,连续性,C
9,1595,单选题,4,人类区别于动物的根本标志是（　　）,制造使用工具,具有宗教信仰,具有思想意识,具有语言文字,A
9,24000,单选题,4,“吃、喝、住、穿，这是人生的第一需要”的观点属于（）,历史唯物主义的观点,历史唯心主义的观点,利己主义的观点,庸俗唯物主义的观点,A
9,24042,单选题,4,一个正确的认识需要经过多次反复才能完成，整个人类的认识是（）,有限与无限的统一,理论与实践的统一,感性与理性的统一,正确与错误的统一,A
9,1627,单选题,4,在其现实性上，人的本质是（　　）,一切社会关系的总和,人的政治立场,人的经济利益,人的价值追求,A
9,24151,单选题,4,除我国之外，（）也提出了仍处于社会主义初级阶段的理论？,苏联,南斯拉夫,越南,古巴,C
9,24033,单选题,4,社会物质生活条件是指（）,全部自然界,人口,地理环境,地理环境、人口和生产方式诸要素的总和,D
9,23465,单选题,4,在劳动资料，最能标志生产力是（）,运输设备,动力系统,传动装置,生产工具,D
9,7163,单选题,4,下列提法正确的是( ),只有空想社会主义思想家预见了未来社会,只有马克思主义经典作家预见了未来社会,只有唯心主义思想家预见了未来社会,许多思想家都预见了未来社会,D
9,7016,单选题,4,社会规律与自然界发展规律的区别在于（  ）,自然规律是客观的，社会规律是主观的,自然规律是自发地起作用，社会规律是通过人们有意识的活动而得到实现,自然规律没有阶级性，社会规律有阶级性,自然规律是可以被认识的，社会规律是不可捉摸的,B
9,22668,单选题,4,马克思主义哲学的研究对象是（ ）,物质世界的一切现象,各个国家和民族发展的具体过程,人们的具体心理过程,自然、社会和思维发展的一般规律,D
9,1705,单选题,3,生产力所体现的关系是（　　　）,人和人的关系,人和物的关系,人和自然的关系,,C
9,1619,单选题,4,划分阶级的主要标志是各种社会集团（　　）,在国家政权中的不同地位,在社会劳动组织中的不同作用,取得劳动产品的不同方式,对生产资料的不同关系,D
9,24592,单选题,4,“在对现存事物的肯定的理解中同时包含着对现存事物的否定的理解，即对现存事物必然灭亡的理解。”这是一种（）,唯物辩证法的观点,相对主义诡辩论的观点,激变论的观点,庸俗进化论的观点,A
9,10162,单选题,4,矛盾具有两个基本属性，其中一个是同一性，另一个是（ ）,普遍性,特殊性,斗争性,客观性,C
9,7075,单选题,4,社会必要劳动时间是在现有的社会正常生产条件下，在社会平均劳动熟练程度和劳动强度下制造某种使用价值所需要的劳动时问，它是以( ),具体劳动为尺度的,简单劳动为尺度的,复杂劳动为尺度的,个别劳动为尺度的,B
9,10164,单选题,4,马克思说：人在“劳动过程结束时得到的结果，在这个过程开始时就已经在劳动者的表象中存在着，即已经观念地存在着”。人的活动的整个过程，就是围绕着“观念地存在着”的目标和蓝图而进行的。这说明了（ ）,人比动物具有更好的记忆力,观念的作用是不能够忽略的,意识具有能动作用,人的劳动过程的特殊性,C
9,1859,单选题,4,对待马克思主义，我们应该采取的态度是（   ）,随着时代的发展，对其做出根本修改,只把它当成过去的一种思想来看待,在实践的基础上把坚持和发展统一起来,要坚持马克思和恩格斯说过的每一句话,C
9,2457,单选题,4,社会主义民主是人类社会最高类型的民主。对此认识不正确的是（     ),社会主义民主与以往剥削阶级占统治地位的社会的少数人的民主在性质上根本不同，它是绝大多数人的民主，本质和核心是人民当家作主,社会主义民主首先是社会主义的国家制度，既是国体，也是政体,社会主义民主是目的和手段的统一,社会主义民主是全民民主，“纯粹民主”,D
9,24036,单选题,4,“支配物理世界之运动的必然性，也支配着精神世界的运动，因而在这个世界中，一切都服从于注定的命运。”这种观点（）,是对必然性的科学揭示,正确地揭示了必然性的作用,会导致“宿命论”,会导致“唯意志论”,C
9,1751,单选题,4,法人资本所有制是(    ) ,国家股东化的产物      ,私人资本股东化的产物,个人资本股东化的产物       ,资本主义生产资料所有制发展的新形式 ,D
9,7006,单选题,4,社会存在(  ),是社会生活的精神方面的总和,是社会物质生活条件的总和,是占统治地位的生产关系的总和,就是指社会环境,B
9,2158,单选题,4,生产商品的抽象劳动的凝结形成（     ）,商品的使用价值,商品的交换价值,商品的价值,商品的价格,C
9,6965,单选题,4,对于哲学史上长期争论不休的唯理论和经验论两大派别的正确评价是( ),唯理论是正确的，经验论是错误的,经验论是正确的，唯理论是错误地,唯理论和经验论各有片面的真理性,唯理论和经验论都是完全错误的,C
9,1873,单选题,4,马克思主义政治经济学的理论基础是（   ）,剩余价值理论,劳动价值论,英国古典政治经济学,辩证唯物主义和历史唯物主义,B
9,7152,单选题,4,科学社会主义创立的理论依据是( ),空想社会主义学说,德国古典哲学,唯物史观和剩余价值学说,英国古典政治经济学,C
9,1649,单选题,4,认识论上经验主义的错误在于（       ）,否认理性认识的重要性,否认感性认识的重要性,否认世界的可知性,否认认识是对客观世界的反映,A
9,2450,单选题,4,空想社会主义理论的合理性表现在（     ),它深刻揭露了资本主义的罪恶,它认为资本主义必须要被社会主义所制度取代,它揭示了资本主义必然灭亡的经济根源,它认为无产阶级是埋葬资本主义的革命力量,B
9,1862,单选题,4,19世纪欧洲空想社会主义是马克思主义直接理论来源之一，其代表人物是(    ),配第、斯密、李嘉图,拉美特利、爱尔维修、狄德罗,康德、黑格尔、费尔巴哈,圣西门、傅立叶、欧文,D
9,2257,单选题,4,假定某一资本的剩余价值率为100%，该资本4年周转一次，试问该资本的年剩余价值率为（ ）,25%,50%,75%,100%,A
9,24124,单选题,4,实践之所以是检验真理的唯一标准，就实践自身的特点而言因为（）,它是对人类有用的活动,它是多数人参加的活动,它是具有普遍性和直接现实性的活动,它是具有主观性的活,C
9,1839,单选题,4,马克思主义哲学按其本质来说是（   ）,运动的、发展的,批判的、革命的,科学的、真理的,实践的、客观的,B
9,2283,单选题,4,从资本形态上看，资本输出的基本形式是(     ),私人资本输出和国家资本输出,国内资本输出和国际资本输出,借贷资本输出和生产资本输出,商业资本输出和金融资本输出,C
9,1863,单选题,4,黑格尔、费尔巴哈是(    ),德国古典哲学的代表人物,英国古典政治经济学的代表人物,英国空想社会主义的代表人物,法国空想社会主义的代表人物,A
9,6991,单选题,4,一个认识的完整过程是（ ）,感性认识——理性认识——感性认识,实践——认识——实践,概念——判断——推理,感觉——知觉——表象,B
9,6978,单选题,4,法国科学家路易.巴斯德说：“在观察事物之际，机遇偏爱有准备的头脑。”这句话强调了( ),人们只有发挥主观能动性才能认识事物,人们获得感性经验至关重要,人们不仅要善于观察事物，而且要善于思考问题,人们在认识事物时要有理性的指导,D
9,1491,单选题,4,共产主义社会实现的必要条件是(    ),各尽所能，按劳分配,生产力高度发展，产品极大丰富,财产公有,按需分配,B
9,7203,单选题,4,理性认识的特点是（ ）,对感性认识的综合,与客观事物无关的人的自由创造物,通过感觉器官对客观事物的直接把握,借助于抽象思维达到对事物本质的把握,D
9,1826,单选题,4,英国古典政治经济学最积极的成果是奠定了这样的基础（  ）,剩余价值论,劳动价值论,再生产理论,流通理论,B
9,24053,单选题,4,检验认识的真理性，就是检验认识是否同（）,已有的理论相符合,已被实践证明的真理相符合,客观事物及其发展规律相符合,党的路线、方针、政策相符合,C
9,24026,单选题,4,下列关于社会改革的说法，错误的是（）,社会改革不改变社会制度的根本性质,是社会制度的根本质变,目的是维护和巩固统治阶级的统治地位,一般不需要采取大规模的武装斗争,B
9,7077,单选题,4,马克思说：“一切商品对它们的所有者是非使用价值，对它们的非所有者是使用价值。”这句话表明( ),有使用价值的不一定有价值,商品的使用价值是对它的购买消费者而言的,商品所有者同时获得使用价值和价值,商品是使用价值和价值的对立统一,D
9,10744,单选题,4,把可直接感知的某种具体实物看作是世界的本原，这种观点属于（ ）,朴素唯物主义,形而上学唯物主义,辩证唯物主义,庸俗唯物主义,A
9,7170,单选题,4,“必然王国”和“自由王国”是( ),时间性概念,空间性概念,历史性概念,物质性概念,C
9,1660,单选题,4,我们承认一切知识的相对性（     ）,必然归结为诡辩论,可以防止认识发展受到阻碍而僵化,必然归结为怀疑主义,必然归结为相对主义,B
9,2161,单选题,4,商品价值量的大小是由（     ）,商品数量的大小决定的,商品的供求关系决定的,生产商品实际耗费的劳动实际决定的,生产商品实际耗费的社会必要劳动决定的,D
9,22656,单选题,4,马克思的包含着新世界观天才萌芽的第一个文件是（）,《1844年经济学－哲学手稿》,《神圣家族》,《关于费尔巴哈的提纲》,《德意志意识形态》,C
9,2392,单选题,4,习近平总书记在庆祝中国共产党成立95周年大会上指出，中国共产党人“坚持不忘初心、继续前进”，就要坚持“四个自信”。在“四个自信中”，（   ）自信是更基础、更广泛、更深厚的自信。,道路,理论,制度,文化,D
9,1682,单选题,4,衡量社会生产力发展水平的客观尺度是（      ）,人民群众的生活水平,生产工具及其使用状况,劳动对象的利用,劳动者的思想觉悟,B
9,10154,单选题,4,事物的性质主要是由（ ）,矛盾的同一性決定的,矛盾的斗争性決定的,主要矛盾的主要方面决定的,矛盾的次要方面決定的,C
