courseId,id,subType,optionCount,subDescript,option0,option1,option2,option3,answer
9,24097,单选题,4,唯物主义认识论和唯心主义认识论的根本区别是（）,前者是可知论，后者是不可知论,前者是能动反映论，后者是机械反映论,前者是反映论，后者是先验论,前者是唯理论，后者是经验论,C
9,2154,单选题,4,通常所说的“物以稀为贵”应该理解为（     ）,商品稀少价值就大,使用价值决定价值,价值决定使用价值,供求关系影响商品价格,D
9,22650,单选题,4,哲学把无产阶级当作自己的物质武器，同样，无产阶级把哲学当作自己的精神武器”，这个论断的含义是（）,马克思主义是无产阶级的世界观和方法论,哲学的存在方式是物质,无产阶级的存在方式是精神,无产阶级掌握哲学就由自为阶级转变为自在阶级,A
9,7127,单选题,4,国家垄断资本主义为向社会主义过渡准备了物质条件是指( ),全面的社会化,全面的商品化,全面的市场化,市场的计划化,A
9,24123,单选题,4,恩格斯说：“社会一旦有技术上的需要，则这种需要比十所大学更能把科学推向前进。”这在认识论上说明（）,技术推动了科学的发展,实践是认识发展的动力,实践是认识的来源,科学技术的发展超过了社会实践的发展速度,B
9,10168,单选题,4,在唯物辩证法的方法论体系中，居于核心的地位的认识方法是（ ）,联系的方法,发展的方法,实事求是的方法,矛盾分析法,D
9,6957,单选题,4,实践的中介是( ),各种形式的工具、手段及其运用的程序和方法,对一事物存在和发展有联系的各种要素的总和,构成事物一切要素的总和,受命于主观，见之于客观的活,A
9,7028,单选题,4,国体是指（ ）,国家的经济体制,国家的政治体制,政权的组织形式,社会各阶级在国家中的地位,D
9,1663,单选题,4,“只有音乐才能激起人的音乐感，对于没有音乐感的耳朵来说，再好的音乐也无济于事。”这说明（     ）,人的认识是主体与客体相互作用的结果与过程,人的感觉能力决定认识的产生和发展,人的认识能力是因人的生理结构决定的,事物因人的感觉而存在,A
9,7172,单选题,4,各尽所能，按需分配是( ),原始社会的分配方式,阶级社会的分配方式,社会主义社会的分配方式,共产主义社会的分配方式,D
9,24061,单选题,4,真理是有价值的，说的是（）,真理是客观的,真理是发展的,真理能满足人的需要,有用的就是真理,C
9,1773,单选题,4,资本主义国家在资本主义生产方式允许的范围内对资本主义生产关系进行一定调整，这种调整对生产力的发展起着（   ）,一定的促进作用,一定的阻碍作用,极大的促进作用,彻底解放的作用,A
9,1824,单选题,4,马克思主义产生于（  ）,帝国主义和无产阶级革命的时代,自由资本主义时代,资本主义由自由竞争发展到垄断时代,资本主义制度走向瓦解的时代,B
9,10173,单选题,4,“居安思危”这句话体现的哲学道理是（ ）,矛盾双方在一定条件下可以相互转化,矛盾既具有普遍性又具有特殊性,内因和外因相结合推动事物发展,事物发展是量变和质变的统一,A
9,2247,单选题,4,在资本主义条件下，部门之间的竞争形成了（    ）,商品的社会价值,商品的市场价格,超额剩余价值,平均利润率,D
9,22638,单选题,4,下列选项属于马克思主义三个主要组成部分之一的是（）,马克思主义政治学,科学社会主义,马克思主义伦理学,空想社会主义,B
9,7001,单选题,4,马克思主义揭示了社会发展的客观规律，为无产阶级革命斗争指明了方向。这说明（ ）,实践是认识发展的动力,实践是检验真理的标准,科学理论对实践具有指导作用,科学理论对实践具有决定作用,C
9,2230,单选题,4,产业资本循环中生产剩余价值的阶段是（    ）,购买阶段　,销售阶段,生产阶段　,流通阶段,B
9,2311,单选题,4,国家垄断资本主义的产生，意味着  (      ),资本主义制度已起了根本性质的变化,资本主义生产关系内部有了局部的调整和变革,资本主义的基本矛盾已不再存在,资本主义的经济危机将不再产生,B
9,24037,单选题,4,人的解放就是（）,实现绝对自由,摆脱规律的支配,摆脱盲目必然性和社会关系的奴役,不受任何束缚,C
9,6884,单选题,4,马克思主义生命力的根源在于( ),以实践为基础的科学性与革命性的统一,与时俱进,科学性与阶级性的统一,科学性,A
9,10845,单选题,4,马克思主义认为，共产主义社会的分配原则是（　）,按劳分配,按需分配,按生产要素分配,平均分配,B
9,7135,单选题,4,社会主义政治制度的基本特征是( ),坚持社会主义方向,无产阶级政党的领导,无产阶级专政的政权,马克思主义的指导,C
9,10809,单选题,4,社会主义实现模式多样化的原因不包括（   ）,政治经济文化水平的发展不同,历史传统不同,指导思想不同,地域环境不同,C
9,7036,单选题,4,社会意识相对独立性的最重要最突出的表现是（）,社会意识的反作用,社会意识的历史继承性,社会意识的发展与社会存在的发展的不完全同步性,社会意识与社会经济发展水平的不完全平衡性,A
9,2171,单选题,4,商品价格的变化同货币本身价值的变化是（     ）,成正比例的,成反比例的,在方向上是一致的,无关的,B
9,1530,单选题,4,当代中国人民为之奋斗的共同理想是（    ）,建设中国特色社会主义,.实现共产主义,彻底消灭剥削,国家自行消亡,A
9,24092,单选题,4,“社会一旦有技术上的需要，这种需要就会比十所大学更能把科学推向前进。”这句话包含的认识论道理是（）,实践是检验认识正确与否的标准,实践是认识发展的动力,实践是认识的来源,实践是认识的目的,B
9,22695,单选题,3,哲学上的两种对立的发展观指的是（ &nbsp; ）,唯理论和经验论,唯物论和唯心论,辩证法和形而上学,,C
9,24083,单选题,4,劳动过程是劳动一般性质和劳动的社会形式的统一。劳动的一般性质是指（）,个人与社会之间的相互作用过程,劳动者相互之间的信息交流过程,人与自然之间的物质变换过程,社会与自然之间的物质变换过程,C
9,1821,单选题,4,无产阶级反对资产阶级的斗争，从根本上说是（   ）,为了政治权力而进行的,为了经济利益而进行的,为了全人类的利益而进行的,为了本阶级的利益而进行的,B
9,2291,单选题,4,自由竞争与生产集中的相互关系是（       ）,生产集中引起自由竞争,生产集中断绝自由竞争,自由竞争引起生产集中,自由竞争否定生产集中,C
9,7078,单选题,4,如果部门劳动生产率下降，同一劳动在单位时间内创造的( ),使用价值量减少，单位产品的价值量增加,使用价值量减少，单位产品的价值量减少,价值量增加，单位产品的价值量增加,价值量减少，单位产品的价值量减少,A
9,1727,单选题,4,资本主义经济的发展为更高级的生产方式创造的物质条件是(    ),市场经济制度的建立,产业工人队伍的壮大,社会生产力的提高,高新科技成果的创造,C
9,24085,单选题,4,社会各种矛盾中最基本的是（）,生产力与生产关系的矛盾,物质生产和精神生产的关系,经济基础和上层建筑的关系,阶级与阶级之间的关系,A
9,7133,单选题,4,两极终结的标志是( ),东欧剧变,苏联解体,第三世界的崛起,中国的强大,B
9,7052,单选题,4,人的最根本的特性是人的（）,自然属性,社会属性,自由的属性,意识特性,B
9,22652,单选题,4,马克思主义的产生对于无产阶级的重大意义之一是（）,使无产阶级革命成为必然,使无产阶级开始登上历史舞台,使无产阶级成为自为的阶级,使无产阶级成为资产阶级的掘墓人,C
9,6919,单选题,4,意识的本质（ ）,在外界刺激下人脑分泌的特殊物质,人脑的机能和对客观存在的反映,人脑纯粹的主观想象,在内外刺激作用下人脑发生的生理变化过程,B
9,2229,单选题,4,在资本循环第一阶段中，货币之所以成为资本关键在于（    ）,货币购买了劳动力,货币购买了生产资料,货币充当了流通手段,货币购买了一般商品,A
9,10789,单选题,4,无产阶级革命的根本问题是（   ）,统一战线中的领导权问题,农民问题,武装斗争问题,国家政权问题,D
9,10875,单选题,4,国家的消灭指的是(   ),社会组织管理机构的消亡,阶级统治的消灭,政治国家的消灭,社会组织的消灭,C
9,2273,单选题,4,最鲜明的体现资本主义国家实质的国家职能（    ）,政治职能,经济职能,社会职能,对外交往职能,A
9,10210,单选题,4,在展望未来社会的问题上，马克思主义与空想社会主义的根本区别是（  ）,展望的内容是否正确,展望的目的和动机是否正确,有没有预见性,立场、观点和方法是否科学,D
9,1532,单选题,4,共产主义社会中人的自由而全面地发展指的是（   ）的发展。,个别人,大部分人,杰出人物,全体社会成员,D
9,24081,单选题,4,人口因素在社会发展中的作用是可以（）,决定社会制度的性质,决定社会制度的更替,制约和影响社会发展,决定国家的贫富强弱,C
9,2176,单选题,4,市场竞争产生的经济条件是（     ）,自然经济,计划经济,商品经济,工业经济,C
9,1764,单选题,4,现代资本主义社会的经济制度是（   ）,前资本主义,自由竞争的资本主义,垄断资本主义,后资本主义,C
9,7039,单选题,4,判断一种生产关系是否先进的根本标志是看它是（  ）,生产资料私有制还是生产资料公有制,促进生产力发展还是阻碍生产力发展,社会化大生产还是个体小生产,封闭的自然经济还是市场经济,B
9,6996,单选题,4,"在认识论上,“跟着感觉走”是（）",唯物主义思想的表现,机械唯物论的观点,不可知论思想的表现,否认理论对实践的指导作用,D
9,2183,单选题,4,随着改革的深人和发展，企业参与激烈的生产竞争，国有企业纷纷合资组建了企业集团，重组国有资产，并在经营上改变了经营品种，实行了经营品种多样化。这个事实说明了价值规律在（     ）,调节生产资料和劳动力在社会各部门的分配,促使商品生产者两极分化,刺激商品生产者改进技术，提高劳动生产率,导致商品生产者优胜劣汰,A
9,22653,单选题,4,马克思主义哲学最显著的、首要的观点是（）,矛盾的观点,实践的观点,事物普遍联系的观点,事物永恒发展的观点,B
9,22687,单选题,4,下列提法中符合主观能动性和客观规律性关系的是（）,人有多大胆，地有多大产,有条件要上，没有条件也要上,异想就能天开,顺理力行万事兴,D
9,2270,单选题,4,资本主义国家的选举的实质是（    ）,资产阶级和无产阶级分权,协调统治阶级内部利益关系和矛盾的重要措施,人民当家作主,每个公民都能通过竞选参与政治活动，表达自己的愿望和要求,B
9,2411,单选题,4,造成社会主义发展道路多样性的现实原因（    ),无产阶级政党自身成熟程度的不同,历史文化传统的差异性,时代和实践的不断发展,革命传统不同,C
9,7056,单选题,4,“手推磨产生的是封建主的社会，蒸汽磨产生的是工业资本家的社会”，这句话揭示了(    ),生产工具是衡量生产力水平的重要尺度,科学技术是第一生产力,社会形态的更替有其一定的顺序性,物质生产的发展需要建立相应的生产关系,D
9,1785,单选题,2,马克思主义公开问世的标志性著作是（   ）,《共产党宣言》,《德意志意识形态》,,,A
9,7201,单选题,4,唯理论和经验论的对立是（ ）,认识路线上的对立,认识理论上的对立,认识机制上的对立,认识方式上的对立,D
9,10767,单选题,4,规律是（ ）,事物和现象之间的内在的、本质的必然的联系,事物和现象之间的外在的、偶然的间接的联系,事物和现象之间的直接的、表面的可能性联系,事物和现象之间的人为的、形式的非本质联系,A
9,1740,单选题,3,资本主义的历史地位是（   ）,寄生的资本主义,过渡的资本主义,腐朽的资本主义,,B
9,6955,单选题,4,实践的主体是( ),绝对精神,具有思维能力、从事社会实践和认识活动的人,人,人的意识,B
9,24010,单选题,4,根据社会意识反映社会存在的程度和特点，可以把社会意识划分为（）,个体意识和群体意识,意识形态和非意识形态,先进意识和落后意识,社会心理和社会意识形式,D
9,24100,单选题,4,“感觉到了的东西，我们不能立刻理解它，只有理解了的东西才能更深刻地感觉它”，这句话表明（）,感性认识是微不足道的,感性认识是认识的高级阶段,理性认识是唯一可靠的,理性认识是认识的高级阶段,D
9,24167,单选题,4,科学社会主义创立的理论依据是（）,空想社会主义学说,德国古典哲学,英国古典政治经济学,唯物史观和剩余价值学说,D
9,7149,单选题,4,实现社会主义的必要政治前提是( ),无产阶级政党的领导,建立广泛的革命统一战线,无产阶级的革命斗争,建立无产阶级专政,D
9,7114,单选题,4,国家垄断资本主义的宏观管理和调节体现的是( ),全体劳动人民的经济利益,个别金融寡头的经济利益,垄断资产阶级的整体利益,国有企业的经济利益,C
9,2302,单选题,4,垄断资本在经济上和政治上统治的目的是（       ）,为了获取平均利润,为了获取高额垄断利润,为了解决资本主义的矛盾,为了缓和资本主义的矛盾,B
9,24047,单选题,4,有人认为，只有感性经验才是可靠的，抽象的理论是不可靠的，这在认识论上犯了（）,唯理论的错误,经验论的错误,形而上学的错误,主观唯心主义的错误,B
9,6898,单选题,4,列宁对辩证唯物主义物质范畴的定义是通过( ),物质和意识的关系界定的,哲学与具体科学的关系界定的,主体和客体的关系界定的,一般和个别的关系界定的,A
9,1841,单选题,4,在英国古典政治经济学中，第一次提出劳动价值论的基本观点的是 (    ),亚当•斯密,大卫•李嘉图,威廉•配第,弗朗斯瓦•魁奈,C
9,7104,单选题,4,第二次世界大战后，发达资本主义国家和私人垄断统治的发展表现在（ ）,托拉斯和康采恩的出现,金融寡头的统治,国际垄断同盟的兴起,形成跨行业跨部门的混合联合企业,D
9,7196,单选题,4,马克思主义之前的一切认识论是非科学的根本原因是（ ）,不懂得认识是一个辩证过程,否认物质第一性，意识第二性,不懂得实践是认识的基础,否认世界的可知性,C
9,1818,单选题,4,马克思主义最崇高的社会理想(    ),实现共产主义,消灭特权、消灭阶级、消灭国家,实现个人的绝对自由,实现普遍人权,A
9,10769,单选题,4,"矛盾的斗争性是一个广泛的哲学范畴,它的含义是（ ）",对立面双方相互依存的性质,对立面双方相互贯通的性质,对立面双方相互转化的性质,对立面双方相互离异、相互排斥的性质,D
9,24049,单选题,4,任何科学理论都不能穷尽真理，而只能在实践中不断开辟认识真理的道路。这说明（）,真理具有绝对性,真理具有客观性,真理具有相对性,真理具有全面性,C
9,7061,单选题,4,人类社会发展的一般规律是(    ),生产方式内部的矛盾规律,生产力和生产关系、经济基础和上层建筑之间的矛盾运动规律,社会存在和社会意识的矛盾规律,物质生产和精神生产的矛盾规律,B
9,2242,单选题,4,剩余价值转化为利润，是由于将剩余价值看作是（    ）,不变资本的产物,所费资本的产物,全部预付资本的产物,资本家“监督劳动”的产物,C
9,2456,单选题,4,社会主义实现模式多样化的原因主要在于（     ),政治经济文化水平的发展不同,历史传统不同,指导思想不同,地域环境不同,A
9,1759,单选题,4,第二次世界大战后，国家垄断资本主义发展的特点是（   ）,发展缓慢不稳定,发展迅速且持续稳定,发展迅速但不稳定,时而削弱，时而发展,B
9,7063,单选题,4,社会革命根源于(    ),人口太多,少数英雄人物组织暴动,先进思想和革命理论的传播,社会基本矛盾的尖锐化,D
9,10807,单选题,4,空想社会主义与科学社会主义的根本区别不包括（   ）,历史观不同,对资本主义制度的态度不同,实现理想的途径不同,依靠的社会力量不同,B
9,10774,单选题,4,提出真正科学的唯物主义物质观的是（ ）,古代朴素的唯物主义,辩证唯物主义,德国古典哲学中费尔巴哈的唯物主义,近代形而上学唯物主义,B
9,7106,单选题,4,在垄断资本主义阶段占统治地位的资本是( ),工业资本,农业资本,银行资本,金融资本,D
9,10764,单选题,4,人们在一定社会条件下进行的实践活动（ ）,都受社会条件的限制,都不受社会条件的限制,都是主观随意进行的,都不是对客观世界的改造,A
9,6921,单选题,4,设想没有物质的运动，是（  ）,机械唯物主义的观点,朴素唯物主义的观点,唯心主义的观点,庸俗唯物主义的观点,C
9,24126,单选题,4,一种认识是不是真理，要看它（）,能否满足人的需要,能否被多数人认可,能否付诸实践,能否在实践中最终取得预期的效果,D
9,23480,单选题,4,改革在历史上具有普遍性，它是（）,社会制度更替的一种形式,统治阶级向被统治阶级妥协,对社会体制进行改善和革新,革命阶级推翻反动阶级统治的斗争,C
9,7011,单选题,4,要判断一种观点的是非对错，下列说法中正确的是（ ）,以伟人之是非为是非,以吾心之是非为是非,以众人的意见定是非,以实践中是否得到证明定是非,D
9,2265,单选题,4,在资本主义国家，代表一定阶级、阶层或集团根本利益的是（）,社会组织,行政机构,政党,民意代表,C
9,2181,单选题,4,价值规律要求，商品的价值由社会必要劳动时间决定，商品交换要以价值量为基础，实行等价交换。这里的“等价交换”（     ）①只存在于交换的平均数中②是指每次交换都是等价的③是指价格与价值相符合的交换④是指等价交换的次数多于不等价交换的次数,②③,①②③,①③,③④,C
9,24120,单选题,4,马克思主义哲学认为，认识的本质是（）,主体对客体的能动反映,主体对客体的直观反映,主体对客体的思维建构,主体对客体的价值判断,A
9,2388,单选题,4,下列哪个选项，不属于科学社会主义与空想社会主义的根本区别（   ）,是否对资本主义进行批判,出发点不同,空想社会主义仅仅是从正义、平等的愿望和道德出发，引出社会主义的结论,科学社会主义是从物质生产活动的规律出发，寻找到社会主义必然实现的客观根据,A
9,7112,单选题,4,国家垄断资本主义是( ),消除生产无政府状态的垄断资本主义,资产阶级国家同垄断资本相互分离的垄断资本主义,资产阶级国家同垄断资本融合在一起的垄断资本主义,带有社会主义因素的垄断资本主义,C
9,2240,单选题,4,在资本主义工资形式上，工人的全部劳动都表现为（    ）,必要劳动　,剩余劳动,无酬劳动,抽象劳动,A
9,14454,单选题,4,无产阶级的科学世界观和方法论是（）,辩证唯物主义,历史唯物主义,唯物主义,辩证唯物主义和历史唯物主义,D
9,7182,单选题,4,根据认识的发展规律，在认识的“熟知”与“真知”问题上的正确观点是（ ）,熟知即真知,熟知不等于真知,熟知起源于真知,熟知必然转化为真知,B
9,22677,单选题,4,在英国古典政治经济学中，第一次提出劳动价值论的基本观点的是(),亚当.斯密,大卫.李嘉图,威廉配第,弗朗斯瓦魁奈,C
9,24040,单选题,4,认识的本质是（）,主体对客体的能动反映,主体对客体的直观反映,主体头脑中固有的,绝对观念在头脑中的显现,A
9,1865,单选题,4,马克思主义理论最根本的本质属性是（   ）,科学性,革命性,实践性,与时俱进,A
9,1607,单选题,4,我国社会主义初级阶段实行以公有制为主体、多种所有制经济共同发展的基本经济制度，促进了生产力的发展。说明实行这种经济制度遵循了（　　）,社会经济制度决定生产力状况的原理,生产力具有加速发展的原理,经济基础具有相对独立性的原理,生产力决定生产关系的原理,D
9,2430,单选题,4,世界上第一个社会主义国家是（    ),波兰人民共和国,巴黎公社,苏维埃俄国,中华人民共和国,C
9,1828,单选题,4,在伦敦海格特公墓的马克思墓碑上，镌刻着马克思的一句名言：“哲学家们只是用不同的方式解释世界，而问题在于改变世界。”这说明(   ),马克思主义既是科学的又是崇高的 ,马克思主义具有持久的生命力,马克思主义重视实践，以改造世界为己任,马克思主义是一个开放的理论体系,C
9,7207,单选题,4,“公说公有理，婆说婆有理”这种看法实质是主张（ ）,真理都是相对的,真理是因人而异的,真理都是绝对的,真理都包含有不依赖于主体和人类的客观内容,B
9,1719,单选题,4,在资本主义发展的初期，占主导地位的所有制是(     ),个人资本所有制,私人资本所有制,法人资本所有制,私人股份资本所有制,A
9,7042,单选题,4,上层建筑是指（  ）,社会的经济制度,占统治地位的生产关系,党委宣传部和组织部,建立在一定经济基础之上的政治.法律.宗教.艺术.道德.哲学等意识形态，以及相应的政治.法律等制度.设施和组织机构,D
9,7218,单选题,4,真理观上的相对主义，错误在于（ ）,夸大真理的相对性，否认真理的绝对性,夸大真理的绝对性，否认真理的相对性,只讲真理的客观性，否认真理的相对性,认为关于同一对象真理性的认识只有一个,A
9,24829,单选题,4,“存在就是被感知”这种观点属于（）,朴素唯物主义,形而上学,主观唯心主义,客观唯心主义,C
9,7083,单选题,4,商品生产者要获得更多收益必须使生产商品的( ),个别劳动时间等于倍加的社会必要劳动时间,个别劳动时间等于社会必要劳动时间,个别劳动时间大于社会必要劳动时间,个别劳动时间小于社会必要劳动时间,D
9,2300,单选题,4,在垄断资本主义阶段占统治地位的资本是(       ),工业资本,农业资本,银行资本,金融资本,D
9,6910,单选题,4,从本质上看，认识是（  ）,主体主观意识的创造,主体对“客观精神”的体验,主体对客体的直观反映,主体对客体的能动反映,D
9,7086,单选题,4,资本集中的方式是( ),资本积聚和资本积累,竞争和剩余价值的资本化,竞争和信用,简单再生产和扩大再生产,C
9,1702,单选题,4,社会物质生活条件是指（　　　）,全部自然界,人口,地理环境,地理环境、人口和生产方式诸要素的总和,D
9,1804,单选题,4,马克思主义的创立在思想和文化方面主要批判地继承、吸收了哪些学说的合理思想（   ）,英国古典哲学、英国古典政治经济学和法国、德国的空想社会主义,德国古典哲学、法国古典政治经济学和法国、英国的空想社会主义,德国古典哲学、英国古典政治经济学和法国、英国的空想社会主义,法国古典哲学、德国古典政治经济学和法国、英国的空想社会主义,C
9,2333,单选题,4,垄断资本输入到发展中国家会造成一系列不利影响，但其中不包括（）,环境污染、能源枯竭,民族工业受到严重冲击,对国际资本依赖性增加,宗教、民族冲突加剧,D
9,1648,单选题,4,认识论上唯理论的错误在于（       ）,否认理性认识的重要性,否认感性认识的重要性,否认世界的可知性,否认认识是对客观世界的反映,B
9,22685,单选题,4,唯物辩证法认为，发展的实质是（）,事物数量的增加和减少,事物的简单重复和循环,新事物的产生和旧事物的灭亡,物体的位置移动或场所的变更,C
9,7013,单选题,4,人口因素对社会发展的影响作用主要是通过(  ),人们的思想观念来实现的,国家的有关政策和法律来实现的,民族习惯和氏族信仰来实现的,物质资料生产方式来实现的,D
9,23989,单选题,4,生产关系所体现的是生产过程中（）,人与自然的关系,人与人的政治关系,人与人的思想关系,人与人的经济关系,D
9,1590,单选题,4,劳动过程是劳动一般性质和劳动的社会形式的统一。劳动的一般性质是指（　　）,个人与社会之间的相互作用过程,劳动者相互之间的信息交流过程,人与自然之间的物质变换过程,社会与自然之间的物质变换过程,C
9,10152,单选题,4,唯物辩证法的根本方法是（ ）,观察实验方法,逻辑推理方法,矛盾分析法,归纳演绎方法,C
