question,options,right_answer
新民主主义革命的胜利是()伟大历史事件,"['19世纪', '20世纪', '21世纪', '18世纪']",['20世纪']
"十八大提出全面建成小康社会的新要求,包括","['实现国民生产总值和城乡居民收入比2010年翻一番', '实现国民生产总值和城乡居民人均收入比2010年翻一番', '实现国内生产总值和城乡居民人均收入比2010年翻一番', '实现国内生产总值和城乡居民收入比2010年翻一番']",['实现国内生产总值和城乡居民人均收入比2010年翻一番']
"新中国成立以来,我们党和政府对台方针政策大致经历了由“解放台湾”到“和平统一”两个重要历史时期.","['对', '错']",['对']
邓小平对时代主题的概括是①和平②稳定③发展④合作,"['①③', '①④', '②④', '③④']",['①③']
"社会主义初级阶段的中心任务是进行经济建设,是否坚持四项基本原则无关紧要.","['对', '错']",['错']
"十七大对全面建设小康社会目标提出新的更高要求：①增强发展协调性,努力实现经济又好又快发展；②扩大社会主义民主,更好地保障人民权益和社会公平正义；③加强文化建设,明显提高全民族文明素质；④加快发展社会事业,全面改善人民生活；⑤建设生态文明,基本形成节约能源资源和保护生态环境的产业结构、增长方式、消费模式","['①②③④⑤', '①③④⑤', '①②③④', '①②③']",['①②③④⑤']
实事求是思想路线的重新确立是在党的,"['第七次全国代表大会上', '第八次全国代表大会上', '十一届三中全会上', '第十二次全国代表大会上']",['十一届三中全会上']
"《新民主主义论》中指出了新民主主义社会的经济构成除了国家资本主义经济外,还有()①国营经济②合作社经济③私人资本主义经济④个体经济","['①②', '①③', '②③④', '①②③④']",['①②③④']
社会主义初级阶段是,"['社会主义经济基础尚未确立的过渡时期', '建立资本主义经济基础的阶段', '中国建设社会主义必然要经历的特定阶段', '马克思主义创始人所指的从资本主义社会到共产主义社会的革命转变阶段']",['中国建设社会主义必然要经历的特定阶段']
"为什么我们过去能在非常困难的情况下奋斗出来,战胜千难万险使革命胜利呢？就是因为我们有理想,有马克思主义信念,有共产主义信念.”这段话揭示了在全社会形成共同的理想和精神支柱是","['社会主义文化建设的发展方向', '社会主义思想道德体系建设要解决的问题和根本', '坚持以继承、借鉴和创新的统一的方针建设社会主义精神文明', '发展先进文化的中心环节']",['社会主义思想道德体系建设要解决的问题和根本']
被称为人民民主专政的坚强柱石的是：,"['工人阶级', '农民阶级', '知识分子', '人民军队']",['人民军队']
"第二次世界大战期间,明确规定将澎湖列岛归还中国的有关国际条约是1.《德黑兰条约》2.《开罗宣言》3.《雅尔塔协定》4.《波茨坦公告》","['2,4', '1,3', '2,3', '1,4']","['2,4']"
生产力中最活跃的因素是：,"['人的因素', '物的因素', '生产资料', '劳动工具']",['人的因素']
邓小平理论形成的现实依据是(&nbsp;&nbsp;),"['改革开放以来社会主义现代化建设的新实践', '1958--1978年社会主义建设失败的历史', '社会主义初级阶段的基本国情', '其他社会主义国家兴衰成败的历史经验']","['改革开放以来社会主义现代化建设的新实践', '社会主义初级阶段的基本国情']"
"十六大确立的()目标,是中国特色社会主义政治、经济、文化全面发展的目标,是与加快推进现代化相统一的目标,符合我国国情和现代化建设的实际,符合人民的愿望.","['全面实现现代化', '全面建设小康社会', '建设高度文明与民主的社会主义法制国家', '真正实现共产主义']",['全面建设小康社会']
"建国后,我国在社会主义建设中经历了许多曲折和失误,原因很多,但归根到底是因为我们","['缺乏建设社会主义的经验', '没有完全搞清楚“什么是社会主义,怎样建设社会主义”', '照抄照搬苏联模式', '没有真正坚持社会主义制度']","['没有完全搞清楚“什么是社会主义,怎样建设社会主义”']"
我国发展中存在的重大问题是,"['资源相对短缺,生态环境脆弱,环境污染大', '资源十分短缺,生态环境脆弱,环境污染严重', '资源相对短缺,生态环境脆弱,环境容量不足', '资源十分短缺,生态环境破坏,环境污染严重']","['资源相对短缺,生态环境脆弱,环境容量不足']"
打倒封建主义官僚资本主义解决,"['民主问题', '民族问题', '宗教问题', '边界问题']",['民主问题']
"2011年8月12日至8月23日,第26届世界大学生夏季运动会在深圳举行,深圳市政府为此开通了相关网络,通过网络征求意见和建议等方式,广泛吸收各种创意和想法,力求打造一个有特色、重创新、很简约的开闭幕式,市民纷纷发表意见,提出建议.根据上述材料可知,这是公民通过()参与民主决策","['社会听证制度', '专家咨询制度', '社情民意反映制度', '信访举报制度']",['社情民意反映制度']
“两型社会“改革试点区是：,"['深圳', '海南', '武汉城市群长株潭城市群', '浦东']",['武汉城市群长株潭城市群']
对经济发展起第一位变革作用的是,"['科学技术', '劳动对象', '劳动工具', '劳动者']",['科学技术']
新时期爱国统一战线的主题是,"['建设中国特色的社会主义', '实现祖国完全统一', '维护世界和平', '加强民族团结']",['建设中国特色的社会主义']
"在同顽固派斗争时,坚持().","['有理有利有节的原则', '有利', '有节', '有理']",['有理有利有节的原则']
"改革开放以来,我国出现了一些新的社会阶层,属于新的社会阶层的是","['工人阶级', '农民阶级', '知识分子', '私营业主']",['私营业主']
人民军队建设的最根本原则是党指挥枪,"['对', '错']",['对']
"2011年4月14日,金砖国家领导人第三次会晤在海南省三亚市举行.除中国外,参加本次会晤的国家还有①俄罗斯②巴西③印度④南非","['②③④', '①②④', '①②③④', '②③④']",['①②③④']
三大改造的目的是为了尽快形成“苏联模式”.,"['对', '错']",['错']
"在马克思主义和中国革命实际相结合的过程,对中国革命危害最大的是","['经验主义', '宗派主义', '自由主义', '教条主义']",['教条主义']
依法治国所依之法最重要的是,"['宪法和法律', '民法和刑法', '宪法和民法', '刑法和宪法']",['宪法和法律']
人民民主专政是我国的,"['政体', '国体', '政体和国体的统一', '国体和政体的统一']",['国体']
"党的十七大明确指出,当前关系国民经济全局紧迫而重大的战略任务是","['加快转变经济发展方式,推动产业结构优化升级', '走新型工业化道路', '建设社会主义新农村', '统筹区域发展']","['加快转变经济发展方式,推动产业结构优化升级']"
“三个代表”重要思想形成的现实依据是(&nbsp;),"['世界格局有了深刻变化', '改革开放进入攻坚阶段', '十三届四中全会以来中国特色社会主义建设取得重大成果', '中国共产党的建设面临新形势和新任务']",['中国共产党的建设面临新形势和新任务']
"2013年11月12日,中共十八届三中全会通过的《中共中央关于全面深化改革若干重大问题的决定》指出,全面深化改革的总目标是完善和发展中国特色社会主义制度,推进国家治理体系和治理能力现代化.必须更加注重改革的系统性、整体性、协同性,加快发展社会主义市场经济、民主政治、先进文化、和谐社会、生态文明,让一切劳动、知识、技术、管理、资本的活力竞相迸发,让()","['发展成果更多更公平惠及全体人民', '一切劳动、知识、技术、管理、资本的活力竞相迸发', '一切创造社会财富的源泉充分涌流', '以上都是']",['以上都是']
实现共同富裕就是实现全体人民的同步富裕.,"['对', '错']",['错']
加强社会主义法律建设的基本要求的核心是,"['有法必依', '有法可依', '执法必严', '违法必究']",['有法可依']
陈云在中共八大上提出的关于社会主义经济制度的设想是,"['“主要公有,次要私有”', '“两参一改三结合', '“三个主体,三个补充”', '“大的集中,小的分散”']","['“三个主体,三个补充”']"
"党的十七大强调,统筹城乡发展,推进社会主义新农村建设,要把如下问题解决好始终作为全党工作的重中之重即","['农民问题', '农村问题', '农业问题', '“三农”问题']",['“三农”问题']
"市场经济时代,提“为人民服务”过时了.()","['对', '错']",['错']
毛泽东在中共八七会议上提出的著名论断是,"['兵民是胜利之本', '须知政权是由枪杆子中取得的', '一切反动派都是纸老虎', '只允许党指挥枪而决不允许枪指挥党']",['须知政权是由枪杆子中取得的']
()是各民族共同团结、共同繁荣政治前提和基础,"['民族平等', '各民族相互促进', '各民族共同发展', '祖国统一']",['民族平等']
我国社会主义初级阶段同新民主主义社会在社会性质上的明显区别在于：①是否存在社会主义公有制经济；②社会主义公有制经济是否成为社会经济的主体；③社会主义根本政治制度是否确立；④马克思主义世界观在整个社会思想文化领域中的指导地位是否得到基本确立,"['①②③④', '②③④', '①②③', '①③④']",['②③④']
新民主主义的经济纲领是没收地主的土地归().,"['国家所有', '资本家所有', '农民所有', '工人所有']",['农民所有']
"从根本上讲,工业化进程就是伴随着科技进步和经济发展的","['产业结构优化和升级', '经济结构的调整和优化', '传统产业空心化', '第三产业突出的发展']",['产业结构优化和升级']
把“和谐”与“富强民主文明”一起写入党的基本路线是在党的,"['十三大', '十五大', '十六大', '十七大']",['十七大']
"1956年,苏共二十大以后,毛泽东提出要","['“照抄苏联”', '“以苏为鉴”', '“三个主体,三个补充”', '实行生产责任制']",['“以苏为鉴”']
建设中国特色社会主义的总布局包括：①经济建设；②政治建设；③文化建设；④社会建设；⑤生态文明建设,"['①②③', '②③④', '①②③④⑤', '①③④⑤']",['①②③④⑤']
"中国的发展离不开世界,这是对()的深刻总结","['世界经济发展史', '中国发展历史', '中国古代发展历史', '中国近代发展历史']",['世界经济发展史']
最先提出“马克思主义中国化”命题的中国共产党领导人是(&nbsp;&nbsp;),"['李大钊', '毛泽东', '陈独秀', '刘少奇']",['毛泽东']
解放战争时期的革命统一战线是().,"['人民民主统一战线', '工农民主统一战线', '抗日民族统一战线', '第一次国共合作统一战线']",['人民民主统一战线']
我国已初步形成、逐步推进的多层次的开放格局是,"['经济特区→沿海开放城市→沿海经济开放区→沿边沿江开放→内地开放', '沿海开放城市→经济技术开发区→沿海经济开放区→沿边沿江开放→内地开放', '经济特区→沿边沿江开放→沿海开放城市→内地开放', '经济特区→沿海开放城市→沿边沿江开放→内地开放']",['经济特区→沿海开放城市→沿海经济开放区→沿边沿江开放→内地开放']
"邓小平南方谈话回答了长期困扰人们思想的一系列重大认识问题,被誉为新时期第二次思想解放的宣言书,邓小平南方谈话发表的时间是","['1978年', '1991年', '1989年', '1992年']",['1992年']
近代中国的社会性质是,"['封建社会', '半封建社会', '半殖民半封建社会', '半殖民地社会']",['半殖民半封建社会']
建设中国特色社会主义首要的基本的理论问题是(),"['什么是市场经济,怎样建立社会主义市场经济体制', '什么是社义社会的主要矛盾,怎样解决这一主要矛盾', '什么是社会主义,怎样建设社会主义', '什么是马克思主义,怎样坚持马克思主义']","['什么是社会主义,怎样建设社会主义']"
"我国对资本主义工商业的社会主义改造中,实行的个别企业公私合营的企业具有","['社会主义萌芽性质', '半社会主义性质', '社会主义性质', '集体主义性质']",['半社会主义性质']
毛泽东思想活灵魂的三个基本方面是()①实事求是②群众路线③独立自主④武装斗争,"['①②③', '②③④', '①③④', '①②④']",['①②③']
"经过延安整风,成为全党共识的是().","['枪杆子里面出政权', '星星之火可以燎原', '反对本本主义', '马克思主义中国化']",['马克思主义中国化']
人类科学文化知识的重要创造者、继承者和传播者是指：,"['工人阶级', '知识分子', '新的社会阶层', '农民阶级']",['知识分子']
中国外交的宗旨是,"['维护世界和平,促进共同发展', '推进国际关系民主化', '反对霸权主义和强权政治', '独立自主']","['维护世界和平,促进共同发展']"
我国由新民主主义向社会主义转变的时期是指,"['1949年10月到1952年12月', '1953年1月到1956年12月', '1957年1月到1966年4月', '1949年10月到1956年12月']",['1949年10月到1956年12月']
"毛泽东提出探索马克思主义同中国实际即社会主义建设实际的“第二次结合”,在总体上没有取得成功,其最根本的原因是()","['教条主义地对待马克思主义', '照搬苏联模式', '没有完全搞清楚“什么是社会主义,怎样建设社会主义”的问题', '以革命的方法搞建设']","['没有完全搞清楚“什么是社会主义,怎样建设社会主义”的问题']"
"毛泽东指出,我国人民民主专政的领导力量是().","['工人阶级', '农民阶级', '城市小资产阶级', '民族资产阶级']",['工人阶级']
中国革命和建设的基本立足点是,"['争取外援', '艰苦奋斗', '独立自主', '利用大国之间的矛盾']",['独立自主']
"中国特色的精兵之路,核心是一个字","['精', '少', '多', '高']",['精']
决定我国现阶段多种所有制经济共同发展的根本原因是,"['资金短缺、就业压力大', '扩大对外开放,与世界经济接轨', '生产力总体状况落后、发展不平衡、具有多层次', '建立社会主义市场经济体制的需要']",['生产力总体状况落后、发展不平衡、具有多层次']
解决城市低收入家庭住房困难的重要制度是,"['经济适用房制度', '商品房制度', '房屋租赁制度', '廉租住房制度']",['廉租住房制度']
"在对资本主义的工商业社会主义改造的第一、第二阶段,采取的利润分配政策是","['定息', '劳资两利', '公私兼顾', '“四马分肥”']",['“四马分肥”']
"关于人权的说法,不正确的是","['人权的基础是生命的生存和发展,没有生存权,其他人权均无从谈起', '人权的实现和社会经济发展程度没有必然关系', '经济文化落后,即使有了先进的社会制度,人权的实现程度也会受到限制', '对于发展中国家来说,生存权和发展权是最根本最重要的人权']",['人权的实现和社会经济发展程度没有必然关系']
"公有制的实现形式,具体是指(&nbsp;&nbsp;)","['社会主义经济制度的实现形式', '公有资产的所有、占有、支配、使用的关系', '公有资产的组织形式和经营方式', '公有资产的最终归属问题']",['公有资产的组织形式和经营方式']
物质运动的存在形式是(&nbsp;&nbsp;),"['时间', '空间', '时间和空间', '实践']",['时间和空间']
“三个代表”重要思想是在科学判断(&nbsp;&nbsp;),"['社会阶层结构的基础上提出来的', '党的自身状况的基础上提出来的', '党的历史方位的基础上提出来的', '国际政治格局的基础上提出来的']",['党的历史方位的基础上提出来的']
我国对外政策的基本立足点是：,"['加强同发展中国家的团结与合作', '维护世界和平,促进共同发展', '和平共处五项原则', '独立自主地处理一切国际事务']",['加强同发展中国家的团结与合作']
"在我国社会主义现代化建设中,必须坚持中国共产党的领导,因为只有坚持党的领导,才能()(1)坚持现代化建设的社会主义方向(2)制定和执行正确的路线、方针和政策,保证社会主义现代化建设的胜利(3)正确处理各种复杂的社会矛盾,把亿万人民团结凝聚起来,共同建设美好的未来(4)维护国家的统一、社会的和谐稳定(5)应对复杂的国际环境的挑战","['(1)(2)(3)(4)(5)', '(2)(3)(5)', '(1)(2)(4)(5)', '(1)(3)(5)']",['(1)(2)(3)(4)(5)']
①党的十五大；②党的十六大；③党的十七大；④党的十八大；强调我国正处于并将长期处于社会主义初级阶段.,"['①②', '①④', '①③④', '①②③④']",['①②③④']
军队建设的中心任务是,"['现代化', '信息化', '革命化', '正规化']",['现代化']
"2013年11月12日,中共十八届三中全会通过的《中共中央关于全面深化改革若干重大问题的决定》提出,公有制为主体、多种所有制经济共同发展的基本经济制度,是()","['中国特色社会主义制度的重要支柱', '社会主义市场经济体制的根基', '中国特色社会主义经济制度的重要支柱', '社会主义市场经济体制的根基']","['中国特色社会主义制度的重要支柱', '社会主义市场经济体制的根基']"
"我国对手工业的社会主义改造,采取从()合作到生产合作的道路","['消费', '供销', '技术', '产品']",['供销']
"邓小平对党的思想路线的内容作了概括,指出：“实事求是,一切从实际出发,理论联系实际,坚持实践是检验真理的标准,这就是我们党的思想路线.”这是在党的","['十一届三中全会上概括的', '十一届四中全会上概括的', '十一届五中全会上概括的', '十二大上概括的']",['十一届五中全会上概括的']
“发展才是硬道理”是谁提出的一个著名论断,"['毛泽东', '邓小平', '江泽民', '胡锦涛']",['邓小平']
我国社会主义四个现代化是：①现代农业②现代工业③现代国防④现代教育⑤现代科学技术,"['①②③④', '①③④⑤', '②③④⑤', '①②③⑤']",['①②③⑤']
"在现代化建设中,具有先导性全局性作用,必须摆在优先发展战略地位的是","['教育', '国防建设', '解放思想', '科学技术']",['教育']
毛泽东第一次系统提出社会主义社会矛盾的学说的著作是,"['《反对本本主义》', '《论十大关系》', '《关于正确处理人民内部矛盾的问题》', '《在中国共产党全国代表大会上的讲话》']",['《关于正确处理人民内部矛盾的问题》']
社会主义核心价值体系的基本内容包括：①马克思主义指导思想；②中国特色社会主义共同理想；③以爱国主义为核心的民族精神；④以改革创新为核心的时代精神；⑤社会主义荣辱观,"['①②③④', '①④⑤', '③④⑤', '①②③④⑤']",['①②③④⑤']
"民主革命时期,中国工人阶级的特殊优点有①深受帝国主义、封建主义和资本主义的三重压迫,革命性最强②同先进的经济形式相联系,富于组织性和纪律性③和广大农民有天然联系,便于结成工农联盟④集中在大中城市和大中型企业部门,便于进行有组织的革命斗争.","['①②③', '①②', '①③④', '①②③④']",['①③④']
"设想存在着不运动的物质,会陷入(&nbsp;)","['形而上学', '诡辩论', '辩证法和形而上学', '唯心论']",['形而上学']
毛泽东系统地阐述社会主义社会的两类矛盾的理论著作是(),"['《关于正确处理人民内部矛盾的问题》', '《论十大关系》', '《论人民民主专政》', '《不要四面出击》']",['《关于正确处理人民内部矛盾的问题》']
市场经济是,"['商品经济充分发展的产物', '自然经济充分发展的产物', '社会分工充分发展的产物', '社会化大生产的产物']",['社会化大生产的产物']
中国无产阶级由自在阶级转变为自为阶级的时期是在,"['1840年鸦片战争之后', '1919年五四运动之后', '1921年中国共产党成立之后', '1949年新中国成立之后']",['1919年五四运动之后']
"始终做到(),是我们党的立党之本、执政之基、力量之源.","['“两个文明建设”', '“三个文明建设”', '以经济建设为中心', '“三个代表”']",['“三个代表”']
"2005年,胡锦涛主席就新形势下发展两岸关系提出的原则性意见是1.坚持一个中国原则不动摇2.争取和平统一的努力绝不放弃3.贯彻寄希望于台湾人民的方针决不改变4.反对“台独”分裂活动决不妥协","['124', '1234', '134', '234']",['1234']
我国社会主义初级阶段：①发展程度还比较低；②社会主义制度已经确立；③正在补资本主义的课；④正在为进入社会主义社会而过渡,"['①②③④', '①②', '③④', '①②③']",['①②']
科学发展观全面体现并进一步丰富和深化了马克思主义对()问题的认识,"['国情', '发展', '社会主义发展阶段', '改革']",['发展']
我国外交政策的根本立场是,"['和平外交', '独立自主', '不结盟', '和平共处']",['不结盟']
"党的先进性,归根到底要看党在推动()中的作用","['群众运动', '阶级斗争', '历史前进', '社会运动']",['历史前进']
在社会主义市场经济条件下能够履行承诺而取得他人信任的品德是,"['信义', '忠义', '重义', '诚信']",['诚信']
四项基本原则是经济建设的(&nbsp;&nbsp;),"['政治保证', '组织保证', '物质保证', '发展动力']",['政治保证']
毛泽东群众路线的核心内容是,"['一切为了群众,一切依靠群众', '从群众中来,到群众中去', '与群众打成一片', '领导与群众相结合']","['一切为了群众,一切依靠群众']"
毛泽东正式提出探索中国社会主义建设道路的文章是,"['《星星之火可以燎原》', '《论十大关系》', '《关于正确处理人民内部矛盾的问题》', '《不要四面出击》']",['《论十大关系》']
一个民族在长期共同社会实践中形成的民族意识、民族心理、民族品格、民族气质的总和概括为,"['民族精髓', '民族精神', '民族之魂', '民族特征']",['民族精神']
近代中国社会的主要矛盾是,"['生产力与生产关系', '经济基础和上层建筑', '帝国主义与中华民族、封建主义与人民大众', '地主阶级与农民阶级']",['帝国主义与中华民族、封建主义与人民大众']
"中共十七届五中全会提出《中共中央关于制定国民经济和社会发展第十二个五年规划的建议》,国务院根据中共中央的建议起草了“十二五”规划纲要草案,随后“十二五”规划纲要须在全国人大十一届四次会议上审议批准,这一过程表明()(1)规划纲要是党的主张和人民意志的统一(2)中国共产党通过国务院行使行政权(3)全国人大是我国的立法机关(4)党的主张经过法定程序成为国家意志","['(1)(4)', '(2)(3)', '(3)(4)', '(1)(2)']",['(3)(4)']
"1941年1月,震惊中外的皖南事变爆发后,《新华日报》刊出周恩来的题词手迹：“为江南死国难者致哀.”“千古奇冤,江南一叶,同室操戈,相煎何急？”大敌当前,中国共产党以民族利益为重,坚持正确的方针和原则,避免了抗日民族统一战线的破裂.这些方针和原则有①既联合又斗争②有理,有利,有节③针锋相对,寸土必争④发展进步势力,争取中间势力,孤立顽固势力","['①④', '②③', '①②', '①②④']",['①②④']
社会主义建设基本力量是,"['工人农民知识分子', '中国人民解放军', '各族人民的团结', '广泛的爱国统一战线']",['工人农民知识分子']
体现社会主义精神文明的性质和方向的是,"['民主法制观念', '思想道德建设', '文化建设', '情感教育']",['思想道德建设']
“三通”是指,"['通商、通航、通邮', '通讯、通航、通邮', '通话.通邮.通商', '通商、通航、通讯']",['通商、通航、通邮']
我国农业合作化过程中建立的初级农业生产合作社的性质是,"['半社会主义性质', '完全社会主义性质', '具有社会主义萌芽性质', '新民主主义性质']",['半社会主义性质']
中国共产党群众路线的主要内容是①一切为了群众②一切依靠群众③一切服从群众④从群众中来⑤到群众中去,"['①②④⑤', '②③④⑤', '①③④⑤', '①②③④']",['①②④⑤']
决定社会主义初级阶段社会性质的最主要因素是,"['我国社会主义初级阶段的主要矛盾', '多种所有制经济共同发展', '生产力水平低,经济文化落后', '公有制为主体']",['公有制为主体']
