question,options,right_answer
中国人民爱国统一战线的组织形式是,"['中国人民政治协商会议', '全国人民代表大会', '中国和平统一促进会', '全球华人反独促统联盟']",['中国人民政治协商会议']
"我国仍处在社会主义初级阶段,说明社会主义不适合我国发展的需要.","['对', '错']",['错']
社会主义公有制经济个人消费品分配的基本原则是,"['按需分配', '按劳分配', '按资分配', '按生产要素分配']",['按劳分配']
香港是亚太的()中心,"['经济中心', '金融中心', '贸易中心', '以上都是']",['以上都是']
"中国无产阶级自身的“特点和优点”在于①不占有任何生产资料②深受帝国主义、封建主义和资本主义的三重压迫③与农民有着天然的联系④人数虽少,但比较集中","['①③④', '①②④', '②③④', '①②③④']",['②③④']
"坚持()的绝对领导,是建设人民军队的根本原则.","['党对军队', '军队对党', '军队对干部', '军队对地方']",['党对军队']
“迎世博迎亚运讲文明树新风”志愿服务活动的开展(&nbsp;&nbsp;)&nbsp;①有利于引导人们加强自身道德修养②表明文化创新可以推动社会实践的发展③表明我国的思想道德建设已达到很高水平④有利于引导我国公民树立社会主义荣辱观,"['①③', '②④', '①④', '①②③④']",['①④']
"由张继刚执导、太原舞蹈团表演的舞剧《千手观音》近且在省城太原隆重上演.舞剧《千手观音》汇集了德国、美国、俄罗斯三国的“外援”.其中俄罗斯圣彼得堡交响乐团以及合唱团担任演奏,在德国的柏林录音.指挥兰德向先生表示：“这个音乐既有东方的特点,又有国际化的元素,我特别希望能把这部作品带到美国去演出！”舞剧《千手观音》的演出成功说明","['加强对外文化交流,是社会主义精神文明建设的根本任务', '中华文化正以深厚的东方底蕴、鲜明的民族风格取代世界各国文化', '要发展面向现代化、面向世界、面向未来的,民族的科学的大众的社会主义文化', '中国特色社会主义文化具有开放性,对外来文化要全盘吸收']","['要发展面向现代化、面向世界、面向未来的,民族的科学的大众的社会主义文化']"
近代中国社会的性质是,"['半殖民地半封建社会', '封建社会', '半殖民地半资本主义社会', '资本主义社会']",['半殖民地半封建社会']
"李某应聘到一企业担任经理,按合同规定,除工资外,他每年可以从企业利润中提5%的报酬.今年他得5万元的提成,这5万元属于","['资金分红收入', '劳动力价值或价格收入', '经营风险收入', '按劳分配收入']",['经营风险收入']
"不断开拓马克思主义理论发展的新境界,就要求党的全部理论和工作,要紧跟时代的步伐,用马克思主义的宽广眼界观察世界；要更加符合实践发展的客观规律；要更加开拓创新.以上这“三个要”体现的是对","['与时俱进的基本要求', '体现时代性的基本要求', '把握规律性的基本要求', '富于创造性的基本要求']",['与时俱进的基本要求']
社会主义初级阶段的各种社会矛盾的解决最终取决于：,"['社会主义公有制程度的不断提高', '按劳分配水平的不断提高', '人民群众生活水平的不断提高', '生产力水平的不断提高']",['生产力水平的不断提高']
现阶段我国各族人民的共同理想是,"['把我国建设成为富强、民主、文明的社会主义现代化国家', '实现祖国统一', '建立各尽所能,按需分配的共产主义社会', '人均国民生产总值到2000年翻两番,实现小康']",['把我国建设成为富强、民主、文明的社会主义现代化国家']
在下列收入中属于按劳分配性质的收入是,"['个体劳动者的劳动所得', '外资企业职工的工资收入', '股份制企业职工按股分红收入', '集体企业职工的劳动收入']",['集体企业职工的劳动收入']
"建设中国特色社会主义,总依据是：","['五位一体', '实现社会主义现代化', '实现中华民族伟大复兴', '社会主义初级阶段']",['社会主义初级阶段']
用法律形式把过渡时期总路线确定为全国人民在过渡时期总任务的会议是,"['第一届全国人民代表大会', '第二届全国人民代表大会', '中国人民政治协商会议', '中共七届三中全会']",['第一届全国人民代表大会']
"发展文化产业是社会主义市场经济条件下满足人民多样化精神文化需求的重要途径.必须①必须坚持社会主义先进文化前进方向,②坚持把社会效益放在首位、③坚持社会效益和经济效益相统一","['①②③', '①②', '②③', '①③']",['①②③']
"按照我国十六届六中全会提出2020年构建社会主义和谐社会的目标,到那时全社会创造活力显著增强,","['创新型国家基本形成', '科学发展观深入人心', '社会生产力水平进一步提高', '经济改革稳步发展']",['创新型国家基本形成']
解决民族问题的基本原则是,"['在少数民族聚居的地方实行民族区域自治', '坚持民族平等、民族团结和各民族共同繁荣', '保护和发展各民族语言文字、尊重各民族风俗习惯', '尊重保护各民族宗教信仰自由']",['坚持民族平等、民族团结和各民族共同繁荣']
"要坚持两手抓,两手都要硬,只有物质文明和精神文明抓好了,才是中国特色社会主义.这是因为()","['物质文明是精神文明的基础,精神文明对物质文明有反作用', '物质文明为精神文明提供物质条件和实践经验', '精神文明为物质文明提供精神动力和智力支持', '以上都是']",['以上都是']
"1992年,海峡两岸关系协会与台湾海峡交流基金会达成的“九二共识”的核心内容是","['搁置争议,共同开发', '和平统一,一国两制', '各自以口头方式表述“海峡两岸均坚持一个中国原则”', '发展两岸关系,推进祖国和平统一']",['各自以口头方式表述“海峡两岸均坚持一个中国原则”']
实行对外开放要处理好对外开放与()的关系,"['独立自主', '自力更生', '闭关自守', '独立自主,自力更生']","['独立自主,自力更生']"
对以改善民生为重点的社会建设作了全面部署的是党的,"['十六大', '十六届四中全会', '十六届六中全会', '十七大']",['十七大']
掲示了事物发展的方向和道路的是().,"['对立统一规律', '质量互变规律', '否定之否定规律', '社会规律']",['否定之否定规律']
"创新是一个民族进步的灵魂,是一个国家兴旺发达的不竭动力.下列对中国特色社会主义的各种创新论述正确的是：①.主要包括理论创新、制度创新、科技创新和文化创新②.理论创新是前提,是关键,要使党和国家的事业不停顿,首先理论上不能停顿③.实践基础上的理论创新是社会发展和变革的先导","['①②', '①②③', '②③']",['①②③']
"辛亥革命是我国近代史上一次比较完全意义上的资产阶级民主革命.这是因为辛亥革命①提出了平均地权,耕者有其田的重要原则②建立了中国近代史上第一个资产阶级政党③制定了比较完整的资产阶级民主革命纲领④结束了封建君主专制制度,建立了资产阶级共和国","['①③④', '②③④', '①②④', '①②③④']",['②③④']
"加强党的先进性建设,必须：()(1)准确把握时代脉搏,保证党始终与时代发展同步伐(2)把实现好维护好发展好最广大人民的根本利益作为党全部工作的出发点和落脚点,保证党始终与人民群众共命运(3)使党的理论和路线方针、政策不断与时俱进,保证党的全部工作始终符合实际和社会发展规律(4)围绕党的中心任务来进行,保证党始终引领中国社会发展进步(5)坚持党要管党,从严治党,保证党始终具有蓬勃生机和旺盛活力","['(1)(2)(3)(4)(5)', '(1)(5)', '(3)(4)(5)', '(1)(2)(3)(4)']",['(1)(2)(3)(4)(5)']
毛泽东首次提出“马克思主义中国化”是在(&nbsp;&nbsp;),"['遵义会议', '瓦窑堡会议', '中共六届六中全会', '洛川会议']",['中共六届六中全会']
"公有制经济主体地位的主要体现是①国有经济占绝对优势②公有资产在社会总资产中占优势③国有企业和集体企业占优势④国有经济控制国民经济命脉,对经济发展其主导作用","['②④', '①②③', '③④', '①②']",['②④']
毛泽东创造性地阐述社会主义社会矛盾问题的著作是(),"['《关于正确处理人民内部矛盾的问题》', '《论十大关系》', '《矛盾论》', '《论人民民主专政》']",['《关于正确处理人民内部矛盾的问题》']
建设中国特色社会主义必须坚定不移地依靠广大农民群众是,"['由农民的数量决定的', '由农业在国民生产中的基础地位决定的', '由突出的农村问题决定的', '由农业、农村、农民问题的重要地位和作用决定的']",['由农业、农村、农民问题的重要地位和作用决定的']
邓小平理论是在(&nbsp;),"['战争与革命成为时代主题的历史条件和国际背景下产生的', '知识经济和科技革命迅速发展的历史条件和国际背景下产生的', '结束冷战、争取和平的历史条件和国际背景下产生的', '和平与发展成为时代主题的历史条件和国际背景下产生的']",['和平与发展成为时代主题的历史条件和国际背景下产生的']
"江泽民在中共十五大报告中指出,近代中华民族面临的两大历史任务是①推翻军阀官僚的反动统治②求得民族独立和人民解放③建立几个革命阶级的联合专政④实现国家的繁荣富强和人民的共同富裕","['①②', '③④', '②④', '①③']",['②④']
"中国的新民主主义革命和旧民主主义革命同属于资产阶级民主主义革命的两个阶段,它们之间的根本区别是革命的对象不同.","['对', '错']",['错']
"江泽民2001年“七一”讲话中指出,个体私营经济中的从业人员是","['工人阶级的重要组成部分', '职业和身份比较固定的弱势群体', '中国特色社会主义事业的建设者', '推动我国先进生产力发展的基本力量']",['中国特色社会主义事业的建设者']
人类社会的基本矛盾是,"['人民日益增长的物质文化需要同落后的社会生产之间的矛盾', '人民日益增长的物质文化需要同落后的社会生产力之间的矛盾', '生产力和生产关系、经济基础和上层建筑之间的矛盾', '无产阶级同资产阶级之间的矛盾']",['生产力和生产关系、经济基础和上层建筑之间的矛盾']
确立知识分子是工人阶级的一部分是在()确定的,"['十一届五中全会', '十二届三中全会', '十一届三中全会', '十二届五中全会']",['十一届三中全会']
下列关于社会主义矛盾的说法中不正确的有(),"['社会主义基本矛盾是对抗性的矛盾', '社会主义存在敌我矛盾和人民内部矛盾两种矛盾', '在社会主义条件下,阶级矛盾基本结束,但还没有完全结束', '社会主义基本矛盾可以通过社会主义制度自身得到解决']",['社会主义基本矛盾是对抗性的矛盾']
"2002年11月,江泽民在()报告中进一步阐述了“三个代表”重要思想的时代背景、历史地位、精神实质和指导意义.","['党的十四大', '党的十五大', '党的十六大', '党的十七大']",['党的十六大']
社会主义初级阶段居于主体地位的所有制形式是,"['国有经济', '公有制', '股份制经济', '混合所有制']",['公有制']
三大改造的完成是我国剥削阶段制度被消灭的标志,"['对', '错']",['对']
"科学技术是第一生产力,国家之间的竞争更多的将是科技力量的竞争,归根到底是","['经济实力的竞争', '人才的竞争', '坚持社会主义精神文明建设必须以马列主义、毛泽东思想和邓小平理论为指导', '政治实力的竞争']",['人才的竞争']
我国对外开放的先头阵地是,"['经济技术开发区', '沿海开放城市→经济技术开发区→沿海经济开放区→沿江沿边开放→内地开放', '经济特区', '保税区']",['经济特区']
"农业社会主义改造中,具有完全社会主义性质的是","['互助组', '合作社经济', '初级社', '高级社']",['高级社']
"坚持和完善社会主义初级阶段个人分配制度,就要规范个人分配秩序,包括①着力提高低收入者收入水平②逐步扩大中等收者比重③有效调解过高收入④坚决取缔非法收入","['①③', '①②③', '④', '①②③④']",['①②③④']
邓小平不断提出和反复思考的首要的基本的理论问题是,"['社会主义本质问题', '改革开放的问题', '社会主义市场经济的问题', '什么是社会主义,怎样建设社会主义的问题']","['什么是社会主义,怎样建设社会主义的问题']"
提出“建设社会主义和谐社会”是党的,"['十六届三中全会', '十六届四中全会', '十六届五中全会', '十六届六中全会']",['十六届六中全会']
按劳分配的尺度是,"['需要', '资本', '劳动', '工作能力']",['劳动']
后来的改革证明当初的三大改造搞错了.,"['对', '错']",['错']
"新中国成立后,中国共产党把独立自主、自力更生运用到外交领域和经济建设方面,形成的方针、政策是①针锋相对、寸土必争的方针②独立自主的和平外交政策③自力更生为主,争取外援为辅的方针④以农业为基础,以工业为主导的总方针","['①②', '②③', '③④', '①④']",['②③']
"民主革命时期,中国工人阶级的特殊优点有①深受帝国主义、封建主义和资本主义的三重压迫,革命性最强②同先进的经济形式相联系,富于组织性和纪律性③和广大农民有天然联系,便于结成工农联盟④D集中在大中城市和大中型企业部门,便于进行有组织的革命斗争","['①②③', '①②', '①②③④', '①③④']",['①③④']
"强调社会主义初级阶段是整个建设中国特色社会主义的很长历史过程中的初始阶段,表明了","['社会主义初级阶段就是社会主义初始阶段', '社会主义初级阶段与建设中国特色社会主义历史进程的内在联系', '社会主义初级阶段是建设社会主义的必经阶段', '社会主义初级阶段是社会主义社会很长的历史过程']",['社会主义初级阶段与建设中国特色社会主义历史进程的内在联系']
我国人民军队的宗旨是：,"['保卫祖国', '全心全意为人民服务', '积极防御', '实现人民军队的革命化、现代化和正规化']",['全心全意为人民服务']
"党的十五大把“三步走”战略的第三步进一步具体化,提出的三个阶段性目标是：①从1981年到1990年实现国民生产总值比1980年翻一番；②从1991年到20世纪末,使国民生产总值再翻一番；③21世纪第一个10年,实现国民生产总值比2000年翻一番；④到建党100周年时,使国民经济更加发展,各项制度更加完善；⑤到21世纪中叶新中国成立100周年时,基本实现现代化","['①②⑤', '①②③', '③④⑤', '②③⑤']",['③④⑤']
"加强军队建设,其中,","['现代化始终是第一位的', '革命化始终是第一位的', '正规化始终是第一位的', '三者都重要']",['革命化始终是第一位的']
"澳门回归祖国,标志着","['中国人民在完成祖国和平统一大业的道路上又迈出了重要一步', '澳门从此结束了殖民主义和资本主义制度', '澳门作为国家的一级地方行政机关,在立法、司法和行政管理等方面从此接受中央政府领导', '祖国和平统一大业完全实现']",['中国人民在完成祖国和平统一大业的道路上又迈出了重要一步']
"实施科教兴国战略,体现了邓小平关于()","['尊重知识,尊重人才的思想', '发展才是硬道理的思想', '科学技术是第一生产力的思想', '教育要面向现代化、面向世界、面向未来的思想']",['科学技术是第一生产力的思想']
共产主义是：①一个伟大的社会理想；②一个科学的理论体系；③一个现实的运动；④共产党人的理想信念和精神支柱,"['①②③④', '①②③', '①③④', '①②④']",['①②③④']
"全面建设小康社会,最根本的是","['扩大对外开放,', '深化改革', '重视教育,把科学技术搞上去', '坚持以经济建设为中心']",['坚持以经济建设为中心']
"党的八大指出,我国社会主义制度建立后,全国人民的主要任务是","['实现国家的工业化,以及对农业、手工业和资本主义工商业的社会主义改造', '集中力量发展社会生产力,实现国家工业化', '消灭剥削制度和剥削阶级', '严格区分和正确处理敌我矛盾和人民内部矛盾']","['集中力量发展社会生产力,实现国家工业化']"
新民主主义革命的伟大胜利为当代中国发展进步奠定了根本政治前提.,"['对', '错']",['对']
"依据香港特别行政区基本法,香港特别行政区享有1.独立的外交权2.行政管理权3.独立的防务权4.独立的司法权和终审权5.立法权","['235', '135', '245', '234']",['245']
在世纪之交中国已经总体上实现的低水平、不全面、发展很不平衡的小康目标.,"['对', '错']",['对']
中国共产党第八次全国代表大会最主要的贡献表现在(),"['坚持既反保守又反冒进的方针', '正确指出国内的主要矛盾', '坚持在综合平衡中稳步前进', '提出了正确处理“十大关系”']",['正确指出国内的主要矛盾']
"建国初期,我国在经济建设上主要采取的模式是","['苏联模式', '东欧模式', '美国模式', '德国模式']",['苏联模式']
构建社会主义和谐社会应遵循的原则(),"['以人为本', '科学发展', '改革开放', '以上都是']",['以上都是']
"我国对外开放必须适应经济全球化趋势的新发展做到①转变对外贸易增长方式,提高对外贸易效益②坚持“引进来”和“走出去”相结合战略③切实维护国家安全④着力提高自我发展能力","['①②③', '①②④', '②③④', '①③④']",['①②③']
"实行何种所有制结构,是由","['社会制度的性质决定的', '生产关系的性质决定的', '人们的社会关系决定的', '生产力的状况决定的']",['生产力的状况决定的']
党的历史文献中第一次提出我国社会主义制度还处于“初级的阶段”这一判断的是,"['1981年《关于建国以来党的若干历史问题的决议》', '1982年党的十二大报告', '1986年《中共中央关于社会主义精神文明建设指导方针的决议》', '1987年十三大报告']",['1981年《关于建国以来党的若干历史问题的决议》']
"随着社会主义改造的基本完成,社会主义经济成分已占","['比较优势', '部分优势', '绝对优势', '领导地位']",['绝对优势']
实行对外开放是,"['我国的长期基本国策', '权宜之计', '实现工业化时期的政策', '发达社会主义的政策']",['我国的长期基本国策']
第一次明确提出“构建社会主义和谐社会”是在党的,"['十六届三中全会', '十六届四中全会', '十六届五中全会', '十七大']",['十六届四中全会']
"坚持实事求是的思想路线,就要大力弘扬与时俱进精神,推进理论创新.","['对', '错']",['对']
"改革开放以来,我国出现了一些新的社会阶层()","['他们是民营科技企业的创业人员和技术人员、受聘于外资企业的管理技术人员、个体户、私营企业主、中介组织从业人员、自由职业人员等', '他们是在党和国家改革开放政策的允许下出现的', '他们是在社会主义公有制和社会主义上层建筑主导国家政治经济生活的总的条件下存在和发展的', '以上都是']",['以上都是']
"对“什么是社会主义,怎样建设社会主义”这个基本理论问题,我们过去①已经搞清楚②没有完全搞清楚③什么也不清楚④不是完全清醒的⑤处于摸索之中","['①②③', '②③', '①④⑤', '②④']",['②④']
中国共产党对中国的政治领导是通过,"['法定程序使自己的路线和政策成为国家意志而实现', '共产党员的先锋模范作用来实现', '强有力的思想政治工作和宣传教育工作来实现', '党的全国代表大会向全国人民代表大会提出建议来实现']",['法定程序使自己的路线和政策成为国家意志而实现']
"1989年,邓小平对江泽民等新的中央领导作出了()的“政治交代”.","['必须坚持以经济建设为中心', '要聚精会神地抓党的建设', '必须坚持四项基本原则', '必须坚持改革开放']",['要聚精会神地抓党的建设']
对公民科学文化素质的要求是(),"['有素质', '有道德', '有理想', '有文化']",['有文化']
以毛泽东为代表的中国共产党人开始探索中国自己的社会主义建设道路的标志是(),"['1956年1月召开的最高国务会议', '《论十大关系》的发表', '中共八大的召开', '《关于正确处理人民内部矛盾的问题》的发表']",['《论十大关系》的发表']
我们的改革①对象是具体体制②目的是解放生产力③原则是坚持社会主义方向④性质是社会主义制度的自我完善和发展,"['①②③', '②③④', '②③', '①②③④']",['①②③④']
"新世纪新阶段,加强党的先进性建设,要紧密结合贯彻落实科学发展观的实践、____、加强党的执政能力建设的实践和保持党同人民群众血肉联系的实践,使党的建设的各项工作经得起实践、历史、人民的检验.","['构建社会主义和谐社会的实践', '严肃党纪', '维护中央权威', '建立集体领导和个人负责的责任制']",['构建社会主义和谐社会的实践']
社会主义初级阶段的起点是在,"['中国人民共和国成立', '党的十一届三中全会召开', '对生产资料的社会主义改造完成之时', '提出社会主义初级阶段理论之时']",['对生产资料的社会主义改造完成之时']
"为了纪念中国共产党建党90周年,重庆市教育工作委等部门将15000套含有《记忆?我爱你中国》,《信念》等内容的“红色光碟”下发到全市所有学校.一股“信念”与“记忆”的热潮在全市学生中掀起.该活动的主要目的是","['实施素质教育,提高学生的文艺素养', '奏响主旋律,提高学生的思想道德水准', '培养爱国情感,促进民族文化繁荣', '发展教育事业,提升教育现代化水平']","['奏响主旋律,提高学生的思想道德水准']"
"“三个代表”重要思想,是在科学判断党的()的基础上提出来的","['历史方位', '指导思想', '历史经验', '现实基础']",['历史方位']
"毛泽东指出,中国新民主主义社会是：","['独立性质的社会', '过渡性质的社会', '发展性质的社会', '和谐性质的社会']",['过渡性质的社会']
"邓小平允许一部分人先富起来,最终实现共同富裕思想的含义是①否定了平均主义②手段是诚实劳动与合法经营③目的是为了实现共同富裕④同等同步富裕","['①', '①②', '①②③', '④']",['①②③']
"十七大报告指出,当前和今后一个时期国际局势发展的基本态势是①局部稳定、总体动荡②总体和平、局部战争③总体缓和、局部紧张④总体稳定、局部动荡","['①④', '①③④', '①②③④', '②③④']",['②③④']
基层民主是社会主义民主的基础性工程.当前我国基层群众性自治组织主要有①村民委员会②居民委员会③职工代表大会④董事会,"['①②③④', '①②③', '①③④', '②③④']",['①②③']
消灭剥削的物质前提是,"['实行社会主义公有制', '实行按劳分配', '实行人民民主专政', '生产力高度发达']",['生产力高度发达']
社会主义是,"['没有剥削的社会制度', '一种模式', '生产力水平高度发达的社会', '共产主义第一阶段']",['没有剥削的社会制度']
"目前我国文化产品种类繁多,良莠不齐,这说明我国文化市场要","['严格规范,整齐划一', '言论自由,顺其自然', '加强管理,正确引导', '全面开放,海纳百川']","['加强管理,正确引导']"
"胡锦涛在“七一”讲话中说,90年来,中国共产党团结带领人民完成了三件大事①完成了新民主主义革命,实现了民族独立、人民解放②完成了社会主义革命,确立了社会主义基本制度③进行了改革开放新的伟大革命,开创、坚持、发展了中国特色社会主义④建立起了社会主义和谐社会","['①②④', '①②③', '②③④', '①③④']",['①②③']
具有中国特色的社会主义改造道路的内容是()①社会主义工业化和社会主义改造同时并举②通过一系列逐步过渡的由低级到高级的社会主义改造形式③和平改造特别是对资产阶级实现了和平赎买④对内改造和对外开放相结合⑤对经济制度的改造与对人的改造相结合,"['①②③④⑤', '①②③', '②③④', '①②③⑤']",['①②③⑤']
