question,options,right_answer
报纸.广播.电视等新闻媒体是党和.政府及人民的,"['喉舌', '工具', '中介', '事业']",['喉舌']
中国和平发展的道路是一条勇于参与经济全球化而又坚持,"['广泛合作互利共赢的发展道路', '独立自主的发展道路', '互不侵犯的发展道路', '平等合作的发展道路']",['平等合作的发展道路']
社会主义国家发展对外经济关系的主要内容和基础是,"['利用外资', '引进技术', '开办经济特区', '发展对外贸易']",['发展对外贸易']
"社会主义初级阶段历史任务的核心内容,是实现","['工业化和经济的社会化、市场化、现代化', '科技教育文化比较发达', '全体人民生活比较富裕', '地区经济文化平衡发展']",['工业化和经济的社会化、市场化、现代化']
“东南西北”问题的核心是,"['东西问题', '西北问题', '东南问题', '南北问题']",['南北问题']
把教育放在优先发展地位的依据是①.教育是实现我国现代化的关键所在②.教育与人才是增强我国综合国力和国际竞争力的决定性因素③.教育与人才培养是实现人的全面发展目标的根本途径,"['①③', '②③', '①②③', '①②']",['①②③']
中国新民主主义革命的开端是五四运动的发生.,"['对', '错']",['对']
人民代表大会制度、政治协商制度等我国具体民主政治制度的实质是,"['权力机关', '行政机关', '咨询机关', '社会主义民主']",['社会主义民主']
毛泽东回答“红旗到底打得多久”疑问的的文章是,"['《中国的红色政权为什么能够存在？》', '《井冈山的斗争》', '《星星之火,可以燎原》', '《反对本本主义》']","['《星星之火,可以燎原》']"
毛泽东第一次使用“思想路线”这一概念是在,"['第一次国内革命战争期间', '第二次国内革命战争期间', '抗日战争期间', '第三次国内革命战争期间']",['第二次国内革命战争期间']
新民主主义革命理论的核心问题是(),"['无产阶级的领导权', '农民问题', '军事问题', '土地问题']",['无产阶级的领导权']
"2001年12月,我国正式成为一个重要国际组织的成员国.这个国际组织是","['世界卫生组织', '国际奥委会', '世界贸易组织', '国际货币基金组织']",['世界贸易组织']
社会主义基本制度在我国初步确立的时间是,"['1956年', '1949年', '1978年', '1921年']",['1956年']
我国基层民主自治的最大特点,"['人民依法直接行使民主权', '直选基层组织领导人', '与基层党组织相分离', '与基层党组织没有领导与被领导的关系']",['人民依法直接行使民主权']
"中国共产党人以自己的无私奉献精神为中华民族的复兴前赴后继、浴血奋战、不屈不挠、艰苦奋斗,中国共产党90年的历史是一部团结带领全国各族人民进行革命、建设和改革并不断取得辉煌成就的历史.中国共产党能够取得辉煌成就,根本原因在于()(1)中国共产党是中国工人阶级先锋队,同时是中国人民和中华民族的先锋队(2)中国共产党坚持在组织上对各民主党派的领导(3)不断加强党的自身建设,努力保持和发展自己的先进性(4)中国共产党增强科学执政、民主执政、依法执政的自觉性和坚定性","['(1)(2)', '(1)(3)', '(2)(4)', '(3)(4)']",['(1)(3)']
构建社会主义和谐社会的实践意义是(),"['是全面建设小康社会的重要目标', '是应对外部挑战的重要条件', '是中国最广大人民的根本利益所在', '以上都是']",['以上都是']
意识在形成过程中所经历的阶段不包括().,"['低等生物的刺激感应性', '一切物质都具有的反应特性', '高等动物的感觉和心理', '低等动物的应激反应']",['低等动物的应激反应']
我国对个体农业进行社会主义改造所采取的形式有：①互助组；②初级社；③高级社；④人民公社；⑤和平赎买,"['①②③④⑤', '①②③④', '①②③', '②③④']",['①②③④']
"对“实事求是”首先作了马克思主义的解释,并把它确立为中国共产党的思想路线的是","['毛泽东', '周恩来', '邓小平', '江泽民']",['毛泽东']
邓小平在()作出对“三个有利于”标准的重要表述,"['党的十二大', '党的十三大', '党的十四大', '1992年南方讲话']",['1992年南方讲话']
邓小平第一次提出“建设有中国特色的社会主义”的概念是在,"['十一届三中全会上', '十二大上', '十三大前夕', '十四大前夕']",['十二大上']
"民族精神是社会主义核心价值体系的重要内容之一,其核心是","['爱国主义', '团结统一', '勤劳勇敢', '自强不息']",['爱国主义']
社会主义的根本任务是,"['解放和发展生产力', '消灭剥削、消除两极分化', '达到共同富裕目标', '实现社会和谐']",['解放和发展生产力']
"1971年10月,恢复中华人民共和国在联合国的合法席位,驱逐台湾当局的非法代表是","['第24届联合国大会', '第25届联合国大会', '第26届联合国大会', '第27届联合国大会']",['第26届联合国大会']
"科学的本质是创新,创新的关键在","['教育', '人才', '发展', '技术革命']",['人才']
当前威胁世界和平稳定的主要因素是,"['军备竞赛', '霸权主义和强权政治', '恐怖主义', '民族宗教矛盾']",['霸权主义和强权政治']
中国资产阶级包括官僚资产阶级、民族资产阶级和城市小资产阶级.,"['对', '错']",['错']
没收官僚资本归(),"['国家所有', '农民所有', '资本家所有', '工人所有']",['国家所有']
马克思主义执政党的最大危险就是(),"['放松思想工作', '脱离群众', '忽视民主', '组织涣散']",['脱离群众']
我国对资本主义工商业的社会主义改造所采取的政策是,"['加工订货', '统购统销', '和平赎买', '公私合营']",['和平赎买']
"我国对资本主义工商业的改造采取国家资本主义的过渡形式,属于高级形式的国家资本主义的是","['委托加工', '计划订货', '统购包销', '公私合营']",['公私合营']
"毛泽东对实事求是的科学含义作出马克思主义界定,并把能否坚持实事求是提到有没有党性或党性纯不纯的高度,是在","['第一次国内革命战争期间', '第二次国内革命战争期间', '抗日战争期间', '第三次国内革命战争期间']",['抗日战争期间']
我国宗教政策是,"['公民信仰自由', '逐步取缔宗教', '公民有不信仰宗教的自由', '宗教信仰者不是社会主义事业建设者']",['公民信仰自由']
在党的十三大政治报告中对社会主义初级阶段和党的基本路线进行系统阐述的是,"['赵紫阳', '邓小平', '胡耀邦', '江泽民']",['赵紫阳']
"十六大报告指出,“必须尊重劳动、尊重知识、尊重人才、尊重创造,这要作为党和国家的一项重大方针在全社会认真贯彻.”在“四个尊重”中,核心是尊重","['劳动', '知识', '人才', '创造']",['劳动']
"我国农业社会主义改造中,农业合作化的最初过渡形式是","['互助组', '初级社', '高级社', '人民公社']",['互助组']
霸权主义和强权政治的最根本的社会根源是,"['强权政治', '垄断资本主义的经济政治制度', '霸权主义', '经济危机']",['垄断资本主义的经济政治制度']
当前维护世界和平的根本途径是,"['实行有效裁军和军控', '发挥联合国的维和作用', '加强国际干预', '反对霸权主义和强权政治']",['反对霸权主义和强权政治']
邓小平理论的精髓是,"['解放生产力,发展生产力', '解放思想,实事求是', '坚持四项基本原则', '“三个有利于”标准']","['解放思想,实事求是']"
"毛泽东第一次对实事求是的科学含义作出马克思主义界定,并把能否坚持实事求是提到有没有党性或党性纯不纯的高度,是在","['第一次国内革命战争期间', '第二次国内革命战争期间', '抗日战争期间', '第三次国内革命战争期间']",['抗日战争期间']
社会和谐的基本条件是：,"['和谐文化', '公平正义', '激发社会活力', '制度建设']",['公平正义']
党的十六大是在我国开始实施社会主义现代化建设()战略部署的新形势下召开的,"['第一步', '第二步', '第三步', '第四步']",['第三步']
毛泽东在晋绥干部会议上的讲活中提出的土改总路线和总政策是①.依靠贫农②.团结中农③.限制富农④.有步骤地、有分别地消灭封建剥削制度⑤.发展农业生产,"['①②④⑤', '②③④⑤', '③④⑤', '①②③']",['①②④⑤']
社会主义社会发展的目的是,"['改革', '发展', '稳定', '自立']",['发展']
"新中国建立以来的30年最大的建设成就,是基本建立了独立的、比较完整的工业体系和国民经济体系,从根本上解决了工业化中“从无到有”的问题.","['对', '错']",['对']
毛泽东认为社会主义社会基本矛盾的特点是,"['相适应', '相矛盾', '又相适应又相矛盾', '不相适应也不相矛盾']",['又相适应又相矛盾']
影响当代世界发展的主要障碍是,"['国际经济旧秩序', '强权政治', '恐怖主义', '国际新秩序']",['国际经济旧秩序']
"进入20世纪90年代,我国对外开放进入了一个新的发展阶段,其显著特点是","['技术引进从注重硬件发展到注重软件', '从兴办经济特区发展到开放沿海港口城市', '从吸收利用外资发展到扩大国际劳务合作和跨国经营', '形成了全方位、多层次、宽领域的对外开放格局']",['形成了全方位、多层次、宽领域的对外开放格局']
市场经济必然带来道德沦丧.(),"['对', '错']",['错']
人的发展是经济社会发展的,"['手段', '目的', '要求', '需要']",['目的']
建设中国特色社会主义文化的重要意义是①现代化建设的重要内容②凝聚和激励全国各族人民的重要力量③、综合国力的重要标志④为现代化建设提供智力支持、精神动力和思想保证,"['①②③④', '①③④', '②③④', '①②③']",['①②③④']
建设资源节约型、环境友好型社会的一个重要途径,"['发展循环经济', '发展绿色经济', '强调国民幸福指标', '发展知识经济']",['发展循环经济']
"某县委要求全县群众干部一心一意谋发展,“不为失败找借口,只为成功找办法”这从一个侧面体现了中国共产党().","['发扬民主,不断完善党的执政方式', '与时俱进,保持党的先进性', '紧紧抓住了党执政兴国的第一要务', '履行组织经济建设的职能']",['紧紧抓住了党执政兴国的第一要务']
我国新的社会阶层包括①.个体户、私营企业主②.自由职业者③.知识分子④.受聘于外资企业的管理技术人员,"['①②③', '①②③④', '①②④', '②③']",['①②④']
2005年胡锦涛同志提出要构建社会主义和谐社会.社会主义和谐社会的主要特征是民主法治以及：①公平正义；②诚信友爱；③充满活力；④安定有序；⑤人与自然和谐相处,"['①②③', '①②③④', '①②③④⑤', '①⑤']",['①②③④⑤']
"邓小平的“台阶式”发展思想,难免会造成经济的大起大落.","['对', '错']",['错']
中国人民政治协商会议是①民主党派的联合组织②国家的权力机关③爱国统一战线组织④共产党领导的多党合作和政治协商制度的重要组织形式⑤有中国特色社会主义政治体制的重要组成部分,"['①②③④⑤', '③④⑤', '①②③', '②③④']",['③④⑤']
“实践是检验真理的唯一标准”的大讨论①为实现党的思想路线的拨乱反正奠定了基础②打破了长期盛行的教条主义和个人崇拜③是十一届三中全会实现伟大转折的思想先导④结束了十年动乱,"['①②③④', '①③', '①②', '①②③']",['①②③']
民族区域自治制度的关键是,"['以聚居区为基础', '建立自治地方', '设立自治机关', '行使自治权']",['设立自治机关']
"毛泽东指出,近代中国社会阶级结构是“两头小中间大”,“两头”指的是①无产阶级②地主大资产阶级③农民④城市小资产阶级⑤其它中间阶级","['①④', '①②', '①②③', '③④']",['①②']
第一次把社会主义初级阶段作为建设中国特色社会主义的全局性问题加以把握的是,"['《关于建国以来党的若干历史问题的决议》', '十二大报告', '《关于社会主义精神文明建设指导方针的决议》', '十三大报告']",['十三大报告']
"我党历来十分重视理论联系实际的原则,江泽民把贯彻理论联系实际的原则提到","['重大理论问题的高度', '重大实践问题的高度', '重大政治问题的高度', '重大思想认识问题的高度']",['重大政治问题的高度']
我国外交政策的宗旨是,"['取长补短、求同存异', '建立国际新秩序', '和平共处五项基本原则', '维护世界和平、促进共同发展']",['维护世界和平、促进共同发展']
堪称我国人民民主专政的坚强柱石的是,"['工人', '农民', '工农联盟', '人民解放军']",['人民解放军']
"1978年,邓小平支持领导的实践是检验真理的唯一标准的大讨论,具体是针对的问题是","['“两个凡是”', '“以阶级斗争为纲”', '苏联模式', '农村家庭联产承包责任制']",['“两个凡是”']
"2010年10月,中共十七届五中全会审议通过的《中共中央关于制定国民经济和社会发展第十二个五年规划的建议》强调,在当代中国,坚持发展是硬道理的本质要求,就是坚持科学发展,更加注重：","['1.以人为本2.全面协调可持续发展3.统筹兼顾4.保障和改善民生,促进社会公平正义', '1.以人为本2.全面协调可持续发展3.保障和改善民生,促进社会公平正义', '1.以人为本2.全面协调可持续发展3.统筹兼顾', '1.全面协调可持续发展2.统筹兼顾3.保障和改善民生,促进社会公平正义']","['1.以人为本2.全面协调可持续发展3.保障和改善民生,促进社会公平正义']"
“一国两制”的含义就是,"['结束敌对状态,共同繁荣', '一个国家、两个政府', '一个国家、两个政党', '一个国家、两种制度']",['一个国家、两种制度']
马克思主义中国化的实质是(),"['将马克思主义运用到中国', '将马克思主义照搬到中国', '将马克思主义基本原理同中国具体实际相结合', '把马克思主义作为中国革命和建设的指导思想']",['将马克思主义基本原理同中国具体实际相结合']
统一战线中的核心问题是,"['力争多数的问题', '平等协商的问题', '党的领导问题', '参政议政问题']",['党的领导问题']
"邓小平指出：“计划经济不等于社会主义,资本主义也有计划；市场经济不等于资本主义,社会主义也有市场.”这个论断说明①计划与市场都是经济手段②计划与市场都是资源配置的方式,本身不具有制度性③计划与市场可在同一社会中共存,共同发挥作用④市场经济可以与社会主义制度相结合","['①③', '②④', '①②③', '①②③④']",['①②③④']
党的基本路线的主要内容是,"['以经济建设为中心', '坚持四项基本原则、坚持改革开放', '建设富强、民主、文明、和谐的社会主义现代化国家', '“一个中心,两个基本点”']","['“一个中心,两个基本点”']"
深化文化体制改革的重点是(&nbsp;&nbsp;),"['健全政策法规', '树立新的文化发展观', '体制机制创新', '政府职能转变']",['体制机制创新']
实事求是思想路线的基本内容包括()①一切从实际出发②一切从观念出发③理论联系实际④实事求是⑤坚持实践是检验真理的唯一标准,"['②③④⑤', '①③④⑤', '①②③⑤', '①②⑤']",['①③④⑤']
"毛泽东在《〈共产党人〉发刊词》中论述了中国共产党在中国革命中的三个基本问题,即().","['实事求是、群众路线和独立自主问题', '土地革命、武装斗争和根据地建设问题', '统一战线、武装斗争和党的建设问题', '新民主主义的政治、经济和文化问题']",['统一战线、武装斗争和党的建设问题']
"“一国两制”构想的提出,是从解决","['台湾问题开始', '香港问题开始', '澳门问题开始', '香港和澳门问题开始']",['台湾问题开始']
"据统计,《喜羊羊与灰太狼》的电影票房过亿元,漫画书发行量突破200万册,销售额超过2000万元,相应的电影图书、玩具产品等衍生品也陆续跟进,成为文化产业扩展经济链条、发挥乘数效应的最佳例证.这表明①文化决定着社会的生产方式②文化生产力在现代经济的总体格局中的作用越来越突出③文化与经济相互交融④文化建设已成为我国社会主义现代化建设的重要战略任务","['①②', '①④', '②③', '③④']",['②③']
"2011年4月,巴西、俄罗斯、印度、中国和南非五国在中国三亚举行的金砖国家领导的第三次会晤,就金砖国家合作机制及共同关心的国际和地区问题进行了坦诚深入的讨论达成广泛共识.金砖国家合作机制①以成员国利益完全一致为基础②是建立国际新秩序的重要力量③是当今时代主题发展变化的产物④是新兴市场国家对话合作的平台","['①③', '①④', '②④', '③④']",['②④']
"社会主义制度为生产力的发展开辟了道路,因此,我国可以在很短时间内赶上或超过西方发达国家.","['对', '错']",['错']
"贫穷不是社会主义,富裕就是社会主义.","['对', '错']",['错']
"关于世界是怎样存在的问题,形成了两种不同的观点,分别是(&nbsp;)","['唯物主义和唯心主义', '辩证法和形而上学', '可知论和不可知论', '唯物史观和唯心史观']",['辩证法和形而上学']
新民主主义革命的对象是①帝国主义②封建主义③官僚资本主义④资产阶级.,"['①②③', '②③④', '①③④', '①②④']",['①②③']
1956年党的“八大”指出今后我国社会的主要矛盾是,"['无产阶级与资产阶级的矛盾', '地主阶级与农民阶级的矛盾', '人民对于经济文化迅速发展的需要同当前经济文化不能满足人民需要的状况之间的矛盾', '生产力与上层建筑还不适应的矛盾']",['人民对于经济文化迅速发展的需要同当前经济文化不能满足人民需要的状况之间的矛盾']
社会主义道德的核心是(&nbsp;),"['为人民服务', '集体主义', '诚实守信', '爱国主义']",['爱国主义']
中国谋求发展的一贯宗旨和原则是努力实现①和平的发展②开放的发展③合作的发展④和谐的发展,"['①②', '①②③', '②③④', '①②③④']",['①②③④']
"邓小平在批判“两个凡是”错误观点时,提出必须","['完整地正确地理解毛泽东思想', '正确地理解毛泽东思想', '完整地理解毛泽东思想', '完整地准确地理解毛泽东思想']",['完整地准确地理解毛泽东思想']
“子罕不受玉”启示我们广大党员干部应该(),"['保持清正廉洁,树立良好道德形象', '密切联系群众,切实履行政府职能', '加强党的建设,发挥领导核心作用', '自觉接受监督,提高依法行政水平']","['保持清正廉洁,树立良好道德形象']"
三个代表重要思想的本质是(&nbsp;&nbsp;),"['执政为民', '改革开放', '发展科技和教育', '发展民主']",['执政为民']
"当前和今后一个时期,我国促进经济增长其中由主要依靠增加物质资源消耗向","['主要依靠技术进步、管理创新、出口拉动转变', '主要依靠产业结构调整、出口拉动扩大内需转变', '主要依靠投资、消费、出口协调拉动', '主要依靠科技进步、劳动者素质提高、管理创新转变']",['主要依靠科技进步、劳动者素质提高、管理创新转变']
“反分裂国家法”,"['首次以国家大法形式宣示了中国人民维护国家统一的决心', '主要针对藏独分子', '主要针对疆独分子', '是建国初期制定的一部专门法']",['首次以国家大法形式宣示了中国人民维护国家统一的决心']
我国社会主义改造全面推开是从()开始的,"['1952年', '1953年', '1951年', '1956年']",['1953年']
新民主主义的经济纲领是没收地主的土地归,"['国家所有', '农民所有', '资本家所有', '工人所有']",['农民所有']
"十七大报告指出,发展中国特色社会主义的一大法宝是","['实事求是', '改革开放', '解放思想', '坚持党的领导']",['解放思想']
从新民主主义向社会主义转变的标志是,"['中华人民共和国的成立', '过渡时期总路线的提出', '社会主义改造基本完成', '第一个五年计划的提前完成']",['社会主义改造基本完成']
我国的人民代表大会制度是()①我国人民管理自己国家的政权组织形式②人民当家作主的政治制度③直接体现我国人民当家作主的社会主义性质④建立其他有关的国家管理制度的基础,"['①②③④', '①②③', '②③④', '①③④']",['①②③④']
"二战以来,导致世界动荡不安的主要根源是","['霸权主义', '恐怖主义', '霸权主义和强权政治', '强权政治']",['霸权主义和强权政治']
"对一切违法犯罪行为都要按照“以事实为依据,以法律为准绳”的原则,给予惩处,概括为：","['违法必究', '有法可依', '有法必依', '执法必严']",['违法必究']
"我国社会主义农业改造中,党在农村的依靠力量是","['贫农', '中农', '贫农,下中农', '雇农']","['贫农,下中农']"
毛泽东指出人民民主专政的职能是()①镇压国内敌对阶级和敌对势力的反抗与破坏②防御国家外部敌人颠覆和侵略③组织和保障社会主义经济建设④扩大和发展社会主义民主⑤不断提高人民的生活水平,"['①②③', '①②③④', '①③④', '①②③④⑤']",['①②③']
"国家出台助学贷款既是运用金融手段支持教育事业的发展,又有利于在青年学子中加强信用教育,加快我国信用体系的建立.()","['对', '错']",['对']
马克思主义中国化经历的三个历史时期是(&nbsp;)：①革命②改造③建设④改革,"['①②③', '①③④', '①③', '②③④']",['①③④']
意识只从其起源看是().,"['自然界发展的产物', '社会历史发展的产物', '人脑的机能和属性', '物质世界的主观映象']",['社会历史发展的产物']
经济全球化的主要特征是,"['世界多极化在曲折中发展', '世界贸易组织的建立', '生产、分配、交换和消费的全球化', '各种区域性经济合作组织的建立']",['生产、分配、交换和消费的全球化']
社会主义思想道德建设的核心是(&nbsp;),"['社会公德', '职业道德', '为人民服务', '集体主义']",['为人民服务']
江泽民提出台湾问题不能无限期拖下去,"['是在十五大上', '是在十六大上', '是在十七大上', '是在建党八十周年纪念大会上']",['是在十六大上']
邓小平明确提出关于社会主义本质的著名论断的时间是：,"['1978年', '1980年', '1989年', '1992年']",['1992年']
"新民主主义社会存在多种经济成分,占绝对优势的是","['国营经济', '合作社经济', '个体经济', '私营经济']",['个体经济']
社会主义市场经济区别于资本主义市场经济的根本特征是,"['宏观调控间接化', '企业经营自主化', '多种分配方式并存', '以公有制为主体']",['以公有制为主体']
党的执政能力建设的总体目标之一是使党成为,"['以人为本的执政党', '科教兴国的执政党', '立党为公执政为民的执政党', '创新发展的执政党']",['立党为公执政为民的执政党']
“两型社会”是指,"['物质文明和精神文明', '资源节约型社会和环境友好型社会', '城市化和新农村建设', '共同富裕和民族复兴']",['资源节约型社会和环境友好型社会']
从一般原理推论出个别结论的思维方法是().,"['归纳方法', '演绎方法', '分析方法', '综合方法']",['演绎方法']
判断改革和一切工作是非得失的标准,"['是姓“资”还是姓“社”', '是独立自主还是自力更生', '是友好往来还是闭关自守', '是“三个有利于”的判断标准']",['是“三个有利于”的判断标准']
判断一种生产关系是否优越的主要标准是看它,"['是否适应了上层建筑发展的要求', '是否扩大了公有制经济的比重', '是否适应了生产力', '是否建立了市场经济体制']",['是否适应了生产力']
我国所有制结构存在多样性的根本原因是,"['生产力水平的多层次性的要求', '社会主义本质的内在属性', '发展社会主义市场经济的需要', '各种所有制形式的性质不同']",['生产力水平的多层次性的要求']
在党和国家工作中的指导地位不断得到巩固的是,"['“三个代表”重要思想', '邓小平理论', '马克思主义', '毛泽东思想']",['马克思主义']
